,month,year,name,link,article
51,8,2010,HIV in semen different from virus in blood,http://timesofindia.indiatimes.com//home/science/HIV-in-semen-different-from-virus-in-blood/articleshow/6384335.cms," WASHINGTON: Scientists claim to have found evidence that HIV-1 in semen is different from HIV-1 in blood, possibly due to changes the virus undergoes in the male genital tract. To better understand the process by which HIV is transmitted, experts compared the gene encoding the major surface protein of HIV in semen and blood. ""In some men, the virus population in semen was similar to that in the blood, suggesting that virus was being imported from the blood into the genital tract and not being generated locally in the genital tract. ""We found two mechanisms that significantly altered the virus population in the semen, showing that virus can grow in the seminal tract in two different ways,"" Ronald Swanstrom of North Carolina University, who led the team, said. In one way, one or more viruses grow rapidly in the seminal tract over a short period such that the viral population in semen is homogeneous as compared to the population in the blood. In the other way, the virus replicates in T cells in the seminal tract over a long period, creating a separate population of virus in semen that is distinct from the blood virus. "
52,8,2010,These HIV+ are taught to be positive,http://timesofindia.indiatimes.com//city/bengaluru/These-HIV-are-taught-to-be-positive/articleshow/6396992.cms," They nurture dreams like any other child of their age, their hopes are the same, they are energetic and enthusiastic too. But their systems have been battling the deadly human immunodeficiency virus (HIV) right from birth. Sneha Care Home makes all efforts to ensure their dreams are not crippled. Though HIV is an increasingly thriving menace in our society, little thought is spared for children who suffer after their parents fall victim to it. For no fault of their's, they are left to face the extreme bitterness of living with the disease. With treatment options expanding, issues about their future get more complex. Sneha Care Home (SCH) stepped in to address these issues. Started on July 14, 2008, SCH and Shining Star School address multiple issues of children infected with HIV, as well as prepare them for a productive and constructive life. ""Now with treatment options increasing dramatically, the life span of HIV-infected has also gone up, making us think of their future too,"" says Fr Mathew Perumpil, director of Sneha Care Home. ""When they grow up and become sexually active, they become potentially dangerous in transmitting the virus. Initially, we used to send our children to nearby schools. Once a teacher in the school noticed one of our boys growing intimate with a girl from his class and alerted us. We were totally unprepared to handle such a situation. That is when we started this new venture with 20 children where they are given value-based education,"" he adds. Now SCH houses 83 children who are below 12 years of age, including 34 girls. Most of them were orphaned due to the deadly HIV and many are with single parent. ""We choose kids from houses where the environment is not conducive for their healthy growth. We take away the burden of bringing up the children from suffering families,"" says Perumpil. Children are educated at the Shining Star School on their premises which ensures a good value system. The school, based on National Open School Curriculum, focuses on encouraging creativity and auditing the aptitude of these children. ""We want them to enter a good profession which is less physically taxing and that will define their self-esteem to live a life full of hope and meaning,"" says Perumpil. The tiny bundles of energy who run around here prove these points. With a smile on their lips and stars in their eyes, they are surging ahead in life. Ten-year-old Varalakshmi wants to become a nurse when she grows up. Ask her why: ""I want to take care of others,"" she quips. Puneet Kumar, 11, wants to be a farmer and is already willing to look after the vegetable garden at SCH. To ensure that these kids don't miss anything in life, SCH sends them to foster homes for holidays. ""We identify and screen the family before sending the children,"" says Perumpil. With all the care and affection from SCH, these children are better equipped to face their future with a smile. "
53,8,2010,Need tailormade counselling for HIV+,http://timesofindia.indiatimes.com//city/chennai/Need-tailormade-counselling-for-HIV/articleshow/6398055.cms," CHENNAI: Their future had appeared bleak. With no medical treatment or hope of life, HIV positive children had little to look forward to. But more than two decades after the deadly disease was first detected in Chennai, several babies now have a chance of survival into adulthood thanks to medical regimen and better nutrition. When the Indian government began the national Anti Retroviral Therapy (ART) for HIV patients in 2004, the programme was a godsend to many infected patients who had even given up on the idea of survival. ""Before the ART programme began, morbidity and mortality rate for HIV positive patients were high,"" says Dr P Manorama, chairperson of the Child Welfare Committee (CWC), who runs a home for HIV positive children in Chennai. Today, mortality levels have significantly reduced, from 13 % in 2005 to 8 % in 2010, according to the Tamil Nadu State Aids Control Society (TANSACS). But all the medical and financial aid given by the government is not enough to offset the need for emotional support for the patients, especially children infected with HIV. According to statistics furnished by TANSACS, there are 11,197 children living with HIV in the state today and a sizeable number among them are adolescents. Daisy David of World Vision, an NGO working with HIV positive teenagers, says there is a large segment of children born with the disease, who have today reached their adolescence. ""Children living with HIV have the same exposure to society and media as other children,"" she points out. ""They too grow up with ambitions and desires. However, the discussions provided by the government are inadequate. They not only need counseling on career ambitions and how to battle life on the professional front, but also on the changes their bodies undergo and their own desires regarding sex, marriage and companionship."" Counselling HIV teenagers about marriage and companionship is rather difficult. ""There is need for counsellors who are equipped to handle all kinds of issues and emotions,"" says Dr.Lakshmibai, project director for Tamil Nadu Aids Initiative (TAI). ""Many of them would like to marry non-infected persons, so there is always the issue of acceptance and rejection,"" says Daisy, who had recently attended a workshop for HIV-infected adolescents in Manipur. ""At Manipur, I met a teenaged boy who was battling rejection after his girlfriend found out he was HIV positive. They all had questions as to whether they could have sexual intercourse with non-infected persons, whether the babies born out of such a bonding would also be infected. The very fact that they needed to ask these questions shows that they are not receiving this kind of information or counselling."" The other issue that social workers stress on is a tailor-made counselling program for drug adherence. According to statistics furnished by the TNSAC, until June 2010, 3,298 people had not returned to their respective ART centres for their regular treatment for a period of one to three months. And 1,192 persons had not returned to the ART centres for treatment in a period of one to three months. "
54,8,2010,"KGH cold-shoulders HIV +ve woman, child",http://timesofindia.indiatimes.com//city/hyderabad/KGH-cold-shoulders-HIV-ve-woman-child/articleshow/6423907.cms," VISAKHAPATNAM: In a shocking incident, a HIV-positive woman and her new-born baby girl were allegedly `ignored' and given a raw deal by the doctors and paramedical staff at King George Hospital (KGH) here. The incident came to light after the woman told about her plight to other patients of a nearby ward. The 25-year-old woman was admitted to KGH by a voluntary organisation on Aug 20 and she gave birth to a baby girl the very next day. While the baby is doing well, the doctors at the gynaecology ward stopped attending to the woman and the baby after coming to know about her HIV-positive status. Shockingly, the woman's husband, a daily wage worker, has also left her after learning that she was afflicted with the deadly virus. ""Neither have my parents nor in-laws come to see me. I don't want to live any more as no one is ready to help me and my child,"" she cried. She belongs to Palasa in Srikakulam district. A pregnant woman hailing from Bhimili, who is also HIV-positive, said the doctors and the staff were not attending to them. ""We do not know how we contracted the virus. But the doctors and the society continue to shun us for no fault of ours,"" she complained. When contacted, KGH superintendent Santaram said an enquiry has been ordered following complaints from HIV-positive patients. ""We are trying to make every medication available for them. The mother and the child would be discharged from the hospital soon as they are doing well,"" he claimed. Meanwhile, swine flu scare has gripped the pregnant women in KGH. With the authorities setting up an exclusive swine flu ward close to the gynaecology ward, all the pregnant women are worried about the welfare of their children. ""How could they be so foolish to set up the swine flu ward next to the gynaecology ward? We are all worried,"" a woman, who is into her advanced stages of pregnancy, said. A six-bed swine flu ward has been set up and already two pregnant women of Vizianagaram suspected to be carrying the H1N1 virus were admitted there. Sources said nearly 50 mothers of new-born babies and pregnant women in the gynaecology ward have been living in fear ever since the swine flu ward came into being. However, the authorities of KGH said the special ward was established since the communicable diseases hospital where swine flu cases are being treated does not have full-fledged facilities to treat pregnant women infected with H1N1 virus. Santaram told TOI that a decision to set up the special ward was taken only after consultations with the higher authorities. Allaying fears of the women, he said: ""The patients in the gynaecology wing need not worry as we have taken every precaution."" Swine flu has so far claimed six lives in the city and the north coastal districts in the last one month. "
55,8,2010,HIV+ suspect 4-yr-old girl sent out of school,http://timesofindia.indiatimes.com//city/hyderabad/HIV-suspect-4-yr-old-girl-sent-out-of-school/articleshow/6425573.cms," ANANTAPUR: In what could be a clear case of social boycott, a four-year-old girl was sent out of a private school by parents of other students suspecting her to be HIV-positive. This shocking incident happened at Rao's English medium private school in Vidyuthnagar area in Anantapur on Tuesday. Angry parents forced the school management to send her out after photographs of her HIV-positive mother and stepfather were splashed in local media a few days ago. Though no medical tests had confirmed that the girl was HIV-positive, the irate parents, who have been staging protests outside the school, forcibly took the girl to a private clinic where the staff refused to conduct medical tests on her. Later, they took her to the government hospital. They insisted that the girl be sent out immediately. It all started when the girl's mother M Lakshmi Devi married another HIV-positive patient K Khader Vali on Aug 20 at the Congress office here in the presence of agriculture minister N Raghuveera Reddy and MP A Venkatrami Reddy on the occasion of Rajiv Gandhi's birth anniversary. The girl was the daughter of Devi and M Kiran Kumar of Pulivendula in Kadapa district. Kiran migrated to Anantapur and worked as a room boy in a lodge. He was diagnosed as HIV-positive three years ago and died in March this year. Devi took shelter at a private NGO since then and the NGO head Usharani, who herself is HIV-positive, convinced Devi to enter into a wedlock with Vali. But with the HIV-positive couple's marriage receiving wide coverage in the local media, the parents swooped on the school and forcibly sent out the poor girl. While Usharani urged the district officials to take stringent action against the erring parents, district educational officer D Premanadam and II Town inspector A Srinivasulu went to the school to convince the parents. When contacted, school correspondent Madhav Rao said they have no objection to the girl studying since she has not tested positive for HIV. ""Why should the poor girl be harassed for no fault of hers,"" Usharani questioned. "
56,8,2010,HIV positive woman dies,http://timesofindia.indiatimes.com//city/bengaluru/HIV-positive-woman-dies/articleshow/6428761.cms,A 34-year-old HIV positive woman died at the destitute rehabilitation centre in Mysore on Tuesday. She was housed at the centre for three months. District minister Suresh Kumar on Sunday directed officials to shift her to a hospital for treatment. 
57,8,2010,AIDS society to hold play on plight of HIV+ victims,http://timesofindia.indiatimes.com//city/allahabad/AIDS-society-to-hold-play-on-plight-of-HIV-victims/articleshow/6441375.cms," ALLAHABAD: To highlight the plight of AIDS victims, specially those living in villages, the Uttar Pradesh AIDS Control Society, UNICEF along with Bharetendu Natya Akademi is organising a play - Shifa - at the north central zone cultural centre auditorium on Saturday. Dr Meesum SAM, assistant district programme officer, AIDS Control, told TOI that the purpose behind organising the play is to tell people about the kind of trauma HIV/AIDS victims undergo in the society. He added that the health department along with the district authorities is making efforts to spread awareness on HIV/AIDS. There have been incidents where AIDS victims were ostracised in the villages, he said, adding that the health department trying to dispel various myths about HIV/AIDS. To spread awareness, the health department has also roped in folk artistes who have organised many folk plays in 12 blocks of the district. On Thursday, a folk show was organised in Bharia and Manda blocks. Chosen specially by UP Aids Control Society, the folk artistes are dispelling myths associated with HIV/AIDS and urging villagers not to boycott those who suffer from this syndrome. District magistrate Sanjay Prasad said the folk artistes have received a good response from villagers and hoped that in future AIDS victims would not face social boycott. He added that folk artistes have been organising plays at bus stands, railway stations and market areas. "
58,9,2010,"Keep HIV+ students away, demand parents",http://timesofindia.indiatimes.com//city/bengaluru/Keep-HIV-students-away-demand-parents/articleshow/6477524.cms," BELGAUM: The Government Kannada School No. 22 in Sadashivnagar here is almost empty these days. Parents have stopped sending their children to the school from Monday after learning that there are HIV-positive students too. They are now demanding that the HIV-positive students be segregated. And quite shockingly, the School Development and Monitoring Committee (SDMC) supported the parents’ demand and passed a resolution in this regard. There are 22 orphan and HIV-positive students under the care of NGO Spandana, who are schooling here. They play and participate in all school activities along with normal students. Recently, when parents of other students learnt about this, they approached the school authorities and asked them to make separate arrangements for HIV-positive students, and warned that they would not send their children. SDMC president Sunanda Kumbhargoudar called a meeting to discuss the matter on Tuesday. Ward councillor Vidya Mali, Spandana president Mahantesh Mali, Cluster Resource Person (CRP) from the education department Vasant Katti and parents were present. During the meeting, Mahantesh Mali took the SDMC members to task. He said there are 34 such children at Spandana, studying in different government schools. “No school has raised any objection so far,” he said. "
59,9,2010,Segregation of HIV+ students,http://timesofindia.indiatimes.com//city/hubballi/Segregation-of-HIV-students/articleshow/6481961.cms," BELGAUM: DDPI V M Patil held an awareness meeting at the Government Kannada School No. 22 here on Thursday, following reports that parents have stopped sending their children to the school after learning that there are HIV+ students too in the institution. The DDPI tried to dispel the myths surrounding the disease. He told parents that HIV is not transmitted by sitting next to each other or sharing books or playing together. Parents had stopped sending their children to the school from Monday. Patil told the School Development and Monitoring Committee that the government guidelines clearly state that HIV positive students cannot be segregated from normal children. Moreover, the school cannot make public diseases children suffer from. Parents of the students, local social worker Sarala Herekar, former mayor Vijay More, BEO A B Pundalik, SDMC chairman Sunanda Kumbhargoudar and taluk level health officials were present at the meeting. The DDPI also assured parents and the school that a health check-up camp would be held every month. Teachers and headmasters will receive training on handling such situations, Patil said. "
60,9,2010,Ujwala project director opposes bias towards HIV+ students,http://timesofindia.indiatimes.com//city/hubballi/Ujwala-project-director-opposes-bias-towards-HIV-students/articleshow/6487870.cms," BIJAPUR: Vasudev Tolabandi, project director of Ujwala Rural Development Society here strongly opposed the decision of SDMC members of Belgaum-based Government Kannada School No 22 about keeping HIV+ students away from their classmates. In a press note issued, he strongly condemned the attitude of SDMC members who supported the demand of parents to segregate the HIV+ students. Tolbandi remembered that in Bagalkot district where a number of HIV+ students studied in different schools, were treated equally along with other students. Generous donors from Albal village comprising milk producers and Union members supplied 96 litres of milk every month to the hostel which was built for the HIV+ students at Muttur rehabilitation centre. ""Discrimination among the students is a very bad thing. It is very shameful on the part of the society as well. Hence it should not be accepted by the government,"" he demanded. "
61,9,2010,Maharashtra to unveil HIV-friendly private sector workplace policy,http://timesofindia.indiatimes.com//india/Maharashtra-to-unveil-HIV-friendly-private-sector-workplace-policy/articleshow/6550108.cms," MUMBAI: Acting on a labour union's demand, the Maharashtra government will soon unveil a HIV-friendly workplace policy. It will be voluntary for the two-crore-plus workforce in private establishments and factories to undergo HIV test, but the policy will ensure that no one faces stigma or is given the pink slip if tested positive. The policy may also pave the way for employees to receive financial support from their employers for treatment, which is expensive. Stating that the policy will be introduced in three months, Maharshtra labour secretary Kavita Gupta said, ""We are fine-tuning a policy that will ensure that there is no discrepancy to any of the person with HIV at his workplace. It will provide employment and social security to HIV-positive persons."" Labour minister Hasan Mushrif said, ""Many of the unions requested the labour department to conduct HIV test for the labourers. The proposal is under consideration. The decision is yet to be taken on the issue."" Incidentally, the first case of AIDS was reported in Mumbai in 1986. According to National AIDS Control Organisation (NACO), 14 districts of Maharashtra figure in the all-India list of 49 districts with high prevalence of HIV/AIDS. There are nearly two crore labourers (excluding farm and domestic workers) in Maharashtra. According to the state labour department, it will be mandatory for all the factories and establishments to adopt the HIV-friendly workplace policy. However, it will be the labourer's discretion whether he/she wants to undergo an HIV test. Those workers who opt for the HIV check-up and test positive can avail the benefit of the policy. ""Those who do not turn up for the check-up will be deprived of the benefits,"" said a health official. Justifying department's move, Gupta said, ""The aim is not to get information on number of HIV-afflicted labourers. Its aim is to provide financial stability (employment) and social security to those who test positive."" She said the introduction of the policy will help earlier detection of HIV. ""Earlier the detection, better the chances of healthy survival of the victim,"" said Gupta. "
62,9,2010,Can HIV positive parents have a healthy baby?,http://timesofindia.indiatimes.com//city/varanasi/Can-HIV-positive-parents-have-a-healthy-baby/articleshow/6580994.cms," While recent WHO figures suggest that around 40 per cent babies borne out of HIV positive parents are carrying HIV infection worldwide, department of obstetrics and gynaecology, Banaras Hindu University, is striving to reduce the percentage to only two with stringent monitoring and management of such cases at the anti-retroviral therapy (ART) centre. ""Out of 130 registered HIV positive patients (pregnant women) in the department, as many as 80 women have already witnessed safe deliveries,"" claimed Sulekha Pandey of department of obstetrics and gynaecology, BHU, during a press conference on Saturday. Similarly, around 13,000 pregnant women have already undergone HIV tests in the past five years after it was made mandatory by the department, she added. Saying that HIV positive cases needed special care and management that included sticking to ART and follow-up medication of child-- if found to be HIV positive-- she also emphasised, if possible, breast feeding by such mothers should be kept minimal as per the instructions of doctors to control the cases. "
