,month,year,name,link,article
83,11,2010,MEA lifts all travel curbs against HIV+,http://timesofindia.indiatimes.com//india/MEA-lifts-all-travel-curbs-against-HIV/articleshow/6996878.cms," NEW DELHI: Foreigners coming to get a look and feel of ""Incredible India"" won't be required to declare their HIV status while filling their visa forms. India has lifted all travel restrictions against HIV-positive patients. In 2002, the Union health ministry had issued a notification, stating that reference to a mandatory test for HIV for India-bound foreign nationals should be removed from visa forms. However, some embassies and consulates failed to enforce it, and continued to display the requirement of HIV test certificate on their websites as well as on visa forms. On September 17, the ministry of external affairs (MEA) sent an email to all its embassies and consulates, clarifying that there are no travel or residency restrictions for People Living with HIV (PLHIV) coming to India. MEA has asked all offices to remove the requirement for HIV test from all visa forms available with Indian Embassies and Consulates. The action was prompted by a parliamentary question on April 15 by Dr E M Sudarsana Natchiappan, MP and a member of the Forum of Parliamentarians on HIV and AIDS (FPA). Welcoming the initiative, Oscar Fernandes, MP and president of FPA, said, ""I am pleased that India has clarified its position to lift HIV-related travel restrictions."" J D Seelam, MP and general secretary FPA, said, ""We welcome the step taken by MEA as globally there are ambiguities about India's standing on travel regulations based on HIV status."" Dr Natchiappan added, ""We commend the leadership displayed by the Indian government. FPA believes that these types of travel restrictions limit the rights of people living with HIV and fuel discrimination and stigma."" Thousands of people across the world have been deported or denied entry into countries because they are HIV-positive. Stigmatising HIV-positive individuals is contrary to effective public health programming. Official data shows that 66 countries deny entry, stay or residence to HIV-positive individuals -- of these nations, 26 deport migrants who test positive, seven refuse permission to stay beyond a certain time bar and six deny entry even for very short-term stay. ""These restrictions are in blatant violation of human rights, they stimulate stigma and discrimination and actually hurt the response to the HIV epidemic,"" said Kevin Moody, International Coordinator and CEO, Global Network of People Living with HIV. Union health secretary K Sujatha Rao believes that irrational discriminatory laws should be lifted. ""In India, we don't have any laws against residence or visit by HIV patient,"" she pointed out. Dr Charles Gilks, UNAIDS country coordinator, said such regulations were issued by many countries in the 1980s when little was known about HIV, and there was more of confusion and fear about the virus. Globally, there is no evidence that such restrictions prevent HIV transmission or protect public health. MEA's move upholds India's commitment to human rights and dignity of all people including those living with HIV. A WHO statement pointed out that such entry restrictions actually pressurise people into concealing their HIV infection from immigration authorities. ""They simply do not carry their HIV medicines on international trips. This could lead to drug-resistant HIV strains that are transmissible to other people. Besides, drug resistance allows HIV to replicate in the body more freely, people with higher viral loads are also more infectious,"" said the statement. The US, China and Namibia recently lifted their decades-old travel laws against HIV-positive patients. "
84,11,2010,"Don't discriminate against ‘private’ HIV+ on treatment, SC tells govt",http://timesofindia.indiatimes.com//india/Dont-discriminate-against-private-HIV-on-treatment-SC-tells-govt/articleshow/6996453.cms," NEW DELHI: The Centre's decision to put conditions while extending crucial second line antiretroviral therapy (ART) to all HIV patients invited sharp criticism from the Supreme Court on Friday. It said when it is a matter of life or death, there can be no discrimination in treatment. In an affidavit before the SC, National AIDS Control Authority (NACO) said second line ART for HIV patients could not be extended to those who had received ""irrational treatment"" by private medical practitioners. It said such persons were either switched to second line treatment at an early stage or were put directly on second line drugs without undergoing the preliminary treatment, thus making them hard cases. NACO's attempt to broadbase its second line treatment by excluding those who had little hope of surviving for long was, prima facie, unpalatable to a Bench of Chief Justice S H Kapadia and Justices K S Radhakrishnan and Swatanter Kumar, which was hearing a PIL filed by NGO Sankalp Rehabilitation Trust. ""We cannot go by this discrimination. Right to life is a constitutional right,"" it said. Solicitor general Gopal Subramaniam explained that world over, it was a common practice that there had to be a rationale for HIV patients for their upgradation from first line to second line treatment. He supplemented NACO's affidavit, which said, ""Irrational treatment prescribed by private medical practitioners where persons are switched to second line treatment without any evidence of treatment failure to first line ART leads to early drug resistance and consequent risk of transmission of resistant virus."" NACO said about 70 hospitals had informed it that there were 24,212 persons on ART, of which 1,074 were put on second line treatment due to toxicity of first line drugs and another 2,173 because of treatment failure. With the PIL claiming that over 15,000 patients were currently receiving second line treatment from private clinics/practitioners, the Bench said, ""How can a person be punished if he is incorrectly treated upon by a private practitioner. Under Article 21, whether this argument can stand has to be seen. People are going to die and this cannot happen."" The anguish of the court forced the government to seek 10 days time to do a rethink. The Centre agreed to call for details from all private hospitals and clinics and file a fresh affidavit. "
85,11,2010,"HIV+ is not the end, says happy and fit 'Mr India'",http://timesofindia.indiatimes.com//city/goa/HIV-is-not-the-end-says-happy-and-fit-Mr-India/articleshow/6984424.cms," PANAJI: In 2007 he won the Mr Manipur body building contest. Seven years before that, in 2000, when Kundrakpam Pradipkumar Singh was diagnosed as HIV+, the state-level wrestler and powerlifter was shattered. For the next two years, he busied himself with the flower garden at home, before hitting the local gym again. Singh is a happy face and fit body that's hard to miss around the Inox courtyard. But what is he doing at Iffi? This indomitable spirit is the inspiration and protagonist of the non-feature film 'Mr India' directed and produced by Haobam Pabam Kumar. Singh was specially invited which is rare for the cast of non-feature films. ""I was not going to let one mistake spoil my future,"" Singh told reporters on Wednesday. ""I want to fight this out and show people like me that it is possible to live it up even when things seem down. Even my doctors advised me against building my body, but I did it. HIV does not kill a man. Society does."" Kumar, an alumnus of the Satyajit Ray Film Institute, got together with friends and pursued his idea of making this film. ""Singh's story is a celebration of life,"" said Kumar. ""We were awarded money when this film won a national award, but none of the people who helped me make the film asked for anything. It was given to Singh for the expensive proteins and supplements he requires to stay fit and build his body."" The second film that promotes HIV awareness in the Indian Panorama section is 'Going the distance', a digital film that revolves around a HIV+ woman's attempt to go ahead in life. Speaking about HIV and Aids in the North East, Kumar said, ""It is a big problem with drugs coming from Burma. In the past, most cases were transmitted through infected syringes. Now most are through sexual transmission and mother to child."" "
86,11,2010,There are 60 HIV+ kids in Varanasi,http://timesofindia.indiatimes.com//city/varanasi/There-are-60-HIV-kids-in-Varanasi/articleshow/7006403.cms," VARANASI: It is not easy for a seven-year-old child living with HIV/AIDS or even his/her parents to talk about the miseries of life before the civil society. But, on the eve of the World AIDS Day, many children living with HIV/AIDS and their parents assembled in the city on Sunday and shared their life experiences and problems, like the discrimination and humiliation they faced in the society. Though there is a programme and facilities to control HIV/AIDS, most of them felt themselves excluded from the society. It was an initiative of the Uttar Pradesh Welfare for People Living with HIV/AIDS (UPNP+) with the support of UNICEF and Media Nest to give a voice to such persons and create awareness among people. Around 15 children from different districts including Varanasi, Chandauli, Jaunpur, Mirzapur and Bhadohi attended the programme. ""In Varanasi, there are 60 children of 5-14 age group who are infected with HIV,"" president of Banaras Network of Positive People Living with HIV/AIDS Society (BNP+) Manoj Kumar Singh informed TOI. According to him, the number of children living with HIV/AIDS (CLHA) in the eastern UP is over 500. The Varanasi district has over 1,000 persons infected with HIV, and the number of such people goes above 11,000 in eastern parts of UP. The UNICEF report estimates that 70,000 children below the age of 15 are living with HIV in India and 21,000 children are infected every year through parent-to-child transmission. According to the 2009-10 annual report of the National AIDS Control Organisation (NACO), demographically the second largest country in the world, India has also the third largest number of people living with HIV/AIDS. As per the provisional HIV estimate of 2008-09, there are an estimated 22.7 lakh people living with HIV/AIDS in India. The HIV prevalence rate in the country is 0.29 per cent (2008-09) and most infections occur through heterosexual route of transmission. However, there are now 33.4 million people living with HIV, according to 2008 figures released by WHO. An estimated 2.7 million were newly infected with the virus and 2 million died of AIDS the same year. To take up the issue World AIDS Day is observed on December 1 to draw together people from around the world to raise awareness about HIV/AIDS. In Varanasi, the anti-retroviral therapy (ART) centre at the Banaras Hindu University (BHU) is playing a remarkable role. According to the records, so far over 11,000 HIV patients have been registered with the ART Centre, Institute of Medical Sciences, BHU. Around 4,500 patients are living on therapy and get regular medicines. The ART at BHU is one of the 10 centres of excellence in HIV care in the country, where the facility of second line drugs is available. It mentors the activity of 11 ART centres in Bihar, UP and Madhya Pradesh. According Kulsum Talha of Media Nest, the children living with HIV should be heard and given due importance to fill them with a sense of respect. They should be encouraged to become a useful component of the society. The National AIDS Control Programme (NACP) III 2007-2012 has the overall goal of halting and reversing the epidemic in India. The NACP III places highest priority on prevention while seeking to integrate care, support and treatment for those affected by HIV/ AIDS. "
87,11,2010,Maharashtra makes good progress in dealing with HIV,http://timesofindia.indiatimes.com//city/pune/Maharashtra-makes-good-progress-in-dealing-with-HIV/articleshow/7014649.cms," PUNE: Maharashtra has reported significant strides in assisting HIV+ patients, in terms of treatment and counselling, as well as in reducing the number of new infections. While the number of people who accessed the state-run Integrated Counselling and Testing Centres (ICTCs) rose from 93,650 in 2008 to 11,53,810 in 2010, the rate of HIV prevalence showed a decline from 16.42% in 2002 to 4.72% in 2010, said Dilip Deshmukh, additional project director of the Maharashtra State AIDS Control Society (MSACS), on Monday. ""The MSACS has been focusing on strengthening the services and improving its access, especially for the people with high risk behaviours, through targeted interventions across the state,"" Deshmukh said. ""The prevention of parent to child transmission (PPTCT) programme, which ensures that every pregnant woman gets screened for HIV and gets medical care has shown remarkable success,"" Deshmukh said. ""In 2002, the HIV prevalence amongst pregnant women was 3.15%. This has been brought down to 0.35%. This year, as many as 8,51,673 women got tested under the PPTCT programme against 21,047 in 2002. For the women in sex work, this rate was contained at 7.4%, a decline of almost 35% from the prevalence of 42.8% in 2004. The MSACS, which runs a comprehensive HIV prevention care, support and treatment programme throughout the state, is implementing the third phase of the National AIDS Control Programme, which calls for decentralisation and subsequent strengthening of services at the district level. This year three anti-retroviral therapy (ART) centres, three second line ART centres and 10 link ART centres have been opened at the district levels, Deshmukh said. ""This has resulted in massive scaling up of the programme with an assurance that even the remote areas get covered."" ""Maharashtra remains a primary destination for migrants due to the huge demand for manpower in various sectors, which include unskilled labourers and construction and industrial workers,"" Deshmukh said. ""Risk perceptions among this population are low due to illiteracy and lack of knowledge about HIV. Considering the significance of this issue, the MSACS is launching a state-level communication campaign for migrants from December 2010 to March 2011, covering around 20 districts where migrant population are high. This will ensure that the HIV prevention messages reach out to each and every migrant and he/she is motivated to access the available services,"" he added. "
88,11,2010,HIV-infected woman fights for a cause,http://timesofindia.indiatimes.com//city/hubballi/HIV-infected-woman-fights-for-a-cause/articleshow/7017576.cms," HUBLI: She wanted to lead a happy married life like other women in society. But her dreams were shattered after she was abandoned by her husband to marry other woman. Her parents refused to support her, while she managed to stay in a small house in a village with her two children. Making the matter worse, a ""close friend"", on the pretext of helping her, pushed her into flesh trade. That's the turn of events in the life of Girija B (name changed) of Kusugal village near here. Her struggle to free herself from the whirlpool did not help. Cursing her fate, the woman continued the profession to raise the children. When she had fever in 2004, Girija tested her blood, only to get the shock of her life __ she was tested positive to HIV/ AIDS. Unable to bear the stigma, she tried to commit suicide. But her determination to prevent other sex workers and innocent people from getting inflicted with the dreaded disease made her to pledge the rest of her life to create awareness on AIDS among the needy. Now, Girija is working full time to reform sex workers and educate people about AIDS. She has reached out to more people after she was picked up by Society for People's Action for Development (SPAD, Hubli). Her active involvement in counselling, educating and creating awareness about AIDS has made her a role model and popular among HIV-positives network in the city. Girija does not only counsel or educate, but also takes care of abandoned HIV-infected women besides helping them get treatment at hospitals. She also keeps tab on each HIV people so they take medicines regularly. Girija also volunteers to conduct the last rites of abandoned HIV patients who die in hospitals. Speaking to `The Times of India', Girija said: ""I want to instill courage and confidence among HIV patients so that they lead life like others. I will serve them till my last breath."" SPAD project manager Suryaji P T said they are providing necessary support to her to help HIV people. "
89,11,2010,DK dist shows decline in HIV cases,http://timesofindia.indiatimes.com//city/mangaluru/DK-dist-shows-decline-in-HIV-cases/articleshow/7018072.cms," MANGALORE: The prevalence of HIV has been showing a declining trend in Dakshina Kannada during the past four years. Though the prevalence rate of 0.75% is higher than the national average of 0.69%, it is still lower compared to the rate of the state, which is at 0.86%. Dr Kishore Kumar, District AIDS Prevention and Control Unit (DAPCU) officer told `The Times of India' that the general cases recorded since 2007 have seen a decline this year till October. While 1,245 positive cases were detected in 2007, this year there have been only 815 till October end. The cases are recorded for 12 months starting January. Of the 815 cases, as many as 297 are from outside the district. The taluk-wise break up of the cases is as follows: While Mangalore recorded the highest at 298, the least was in Sullia at 22, followed by Bantwal (82), Belthangady (62) and Puttur at 55. Of these, 528 cases are male and 287 are women. Dr Kishore said the prevalence as usual was the highest among the sexually-active in the age group of 16 to 45 at 656. There 12 children with HIV below the age of five and 24 in the group of five to 15 years. The DAPCU officer said 90% of the transmission cases were by the sexual route. Among pregnant women, 41 HIV cases have been recorded till date this year. In this case also, the figures have seen a decline since 2007 from 82, despite the number of patients tested was 19,421 as compared to 14,764 cases tested in 2007. Dr Kishore said the nevirapine (drug used to treat HIV infection) regimen with pregnant women had seen mother-to-child transmission cases come down drastically. ""Of the 72 deliveries, we have had only two positive cases,"" he said. Nevirapine is administered both to mother and child (within 72 hours) at the time of delivery. The child is tested with DNA PCR for infection at six weeks and whatever the result, the anti-body test is done after 18 months for confirmation. stanly.pinto@timesgroup.com "
90,11,2010,HIV+ persons deserve a dignified life,http://timesofindia.indiatimes.com//city/allahabad/HIV-persons-deserve-a-dignified-life/articleshow/7018407.cms," ALLAHABAD: The rising number of AIDS cases raise a serious concern in the society. With no treatment available for it, prevention is the only way to control AIDS cases. Add to this social stigma, ostracism and multiple legal issues, AIDS gets more complex, specially in countries like India. HIV the etiological agent of AIDS belongs to the Lentivirus subgroup of the family retroviridae. It is a challenging issue across the world. The virus is present in blood, tissue and all body fluid of infected persons. HIV is spread by sexual contact with infected persons (heterosexual or homosexual), by blood and blood products, and from infected mother to babies. About 85% AIDS cases are due to sexual contact 3.80%, 2.05%, 3.34% and 6.46% due to prenatal transmission, blood transfusion, injecting durg users and others respectively. The World AIDS Day is being observed since December 1, 1988, and aims at raising money, increasing awareness, fighting prejudice and improving education. The theme for this year is ""Universal access and human rights"". World AIDS Day reminds people that HIV still exists and a lot still needs to be done. Head, department of forensic medicine, MLN Medical College, Dr US Sinha says, ""In a study conducted by our department in 2009-10 shows that 75% men and 25% women came for HIV tests here. Out of these, 18.6% men and 12% women were found HIV positive. The maximum HIV+ cases were in the age group of 25-34 years. As far as distribution of persons suffering from psychosomatic disorder is concerned, over 94% people express shock, stigmatisation (76%), discrimination (70%), family violence (47%), social violence (31%), family rejection (41%), social rejection (64%), depression (88%), loneliness (76%), fear (100%) and suicidal tendency (58%). Dr Sinha says as the incidence and public awareness of required immunodeficiency syndrome increases, the ethical, legal and regulatory mechanism too are becoming significant. In August 1989, the AIDS Prevention Bill was moved in Parliament. The section 4 of the bill mandates every registered physician to report each case of HIV positive patient to health authorities, but does not provide a confidentially clause. Section 7 of the Bill however, requires health authorities to undertake counselling, health education and specialised treatment. But this is of no avail if confidentiality is not guaranteed. Section 5 talks of precautionary measures to curb the spread of infection. As far as law and regulations governing HIV infected persons is concerned, Article 21 of the Constitution guarantees right to life and personal liberty to every HIV positive person. Besides, it's the fundamental right of every AIDS patient to have access to proper treatment. An HIV infected person also has the right to privacy. The right to privacy of a person has been stated in Article 12 of the Universal Declaration of Human Right, Article 17 of the international covenant on civil and political rights and Article 21 of the Constitution. Moreover, Articles 14 and 16 of the Constitution guarantee equality and provide against discrimination in employment respectively. Article 16 prohibits discrimination in public employment on grounds of religion, caste, creed, sex, colour etc. "
91,12,2010,Idli shop helps HIV+ women live positively,http://timesofindia.indiatimes.com//city/chennai/Idli-shop-helps-HIV-women-live-positively/articleshow/7018829.cms," MADURAI: A small idli shop at Usilampatti in south Tamil Nadu is the talk of the town which is otherwise notorious for female infanticide. At daybreak, people begin to crowd around in the bustling marketplace to buy idlis and dosas from a woman who is HIV positive. Vijayarani's customers are aware of her condition, but have no problem patronising her. Vijayarani and her co-worker Sumathy, 40, who is also HIV positive, run the shop together, earning up to Rs 500 per day. On the eve of World AIDS day, the duo serve as yet another reminder of the manner in which the stigma attached to the disease can be overcome even in a socially backward town like Usilampatti. It was only three years ago that Vijayarani's world fell apart. She and her six-year-old son were diagnosed as HIV-positive. But when her husband, Elango, tested negative, he began taunting his wife and finally told her that he was leaving her for good. Vijayarani had contracted the disease from her first husband, who had died a few years earlier. ""Initially, I was devastated. I didn't know what to do. Then, I heard about the Vaigai network of people living with HIV/AIDS,"" she said. These women do not hide the fact that they are carriers of the deadly virus, but say that the society around them has come to accept them. ""People have come to realise that mere physical contact with a HIV-positive person does not spread the disease,"" she pointed out. Frail and thin, Vijayarani started out on anti-retroviral therapy (ART) soon after the diagnosis, and alongside struggled to achieve financial independence. ""I look as healthy as any woman in our village and we have a successful business. Isn't that proof enough?"" she said in between ladling sambar for her customers. Vijayarani admitted her son in school after informing the authorities of his condition. Now the nine-year-old is a student in the fifth standard who comes within the top ten ranks in the class. T Rajapandian, a local, who frequents the shop, vouches for Vijayarani. ""There is nothing to beat her two-rupee idlis and dosas and the tasty accompaniments. I also take parcels home for my children at nights,"" he said. P Annathai, who had been instrumental in spreading awareness about the shop, said, ""I told my family and friends that we should help them and not shun them."" Dr E S Thangapandian, programme manager of the government-run district AIDS Prevention and Control Unit said, ""Theirs is an example for many to follow"". "
92,12,2010,New treatment to stop HIV+ mom-to-child transmission,http://timesofindia.indiatimes.com//home/science/New-treatment-to-stop-HIV-mom-to-child-transmission/articleshow/7019000.cms," NEW DELHI: Working towards complete elimination of pediatric HIV, Naco is changing its treatment protocol for HIV-positive pregnant mothers. As of now, women under the Prevention of Parent-To-Child Transmission of HIV programme are given a single dose of Nevirapine at the time of labour and to the newborn after the delivery. Now, Naco has decided that if the pregnant HIV woman is found to have blood CD4 count below 350, she will be put on a full-fledged anti retroviral therapy. However, if the woman’s blood CD4 count is above 350, she will be put on a more effective drug, Zidovudine, right from 16 weeks of pregnancy till the delivery. However, the new-born will be administered Nevirapine throughout the breast- feeding period. "
