,month,year,name,link,article
20,4,2010,Hope for shot? Structure of HIV protein unveiled,http://timesofindia.indiatimes.com//home/science/Hope-for-shot-Structure-of-HIV-protein-unveiled/articleshow/5758543.cms," NEW YORK: In a breakthrough which may pave the way for a vaccine against AIDS, scientists have provided what they claim is the first-ever glimpse of the structure of a key protein, gp120, found on surface of a subgroup of HIV-1. In addition, the scientists from California Institute of Technology demonstrated that a particular antibody to gp120 makes contact not only with the protein, but with CD4 receptor that gp120 uses to gain entrance into the body's T cells. This three-dimensional understanding of how gp120 is built is more than just a basic scientific advance, they say. ""There's a tremendous continuing effort to develop a vaccine for HIV and most of those efforts use gp120. Having more structural information will facilitate better vaccine design,"" said lead scientist Ron Diskin. The team looked specifically at gp120 from what is known as clade C HIV-1. To explain what that means, here's a brief HIV family history: Most people who get HIV and proceed to AIDS are infected with a member of the HIV-1 family of viruses. HIV-1 is divided into groups; most AIDS-related strains of the virus come from group M. The groups are further subdivided into what are known as clades. Clade B is the form of group M HIV-1 most often found in the United States and western Europe, and the one that is probably best-studied to date. Clade C, the clade studied by the Caltech team, is ""the one that is devastating Africa and Asia,"" said Diskin. ""It's the one that probably causes the largest number of infections worldwide."" In order to uncover the structure of clade C gp120--and determine if the hypothesis about its similarities was indeed true — the Caltech team needed to crystallize the protein. That was no easy task. Turns out, says Diskin, the protein itself is not stiff enough for crystallization. And so the researchers created a complex of molecules consisting of a gp120 monomer, a CD4 receptor, and an anti-HIV antibody known as 21c. "
21,5,2010,NACO to set up centre for HIV patients in city,http://timesofindia.indiatimes.com//city/ludhiana/NACO-to-set-up-centre-for-HIV-patients-in-city/articleshow/5935490.cms," LUDHIANA: After working on the oral substitution therapy, the National Aids Control Organization (NACO) will set up a community care centre for HIV patients in the city, the third such in the state. According to information, two community care centres for HIV patients are already functioning in Patiala and Amritsar, respectively. Talking to TOI on Saturday, an official of the health department said, “The project will be in joint collaboration with Red Cross as it has received grants of Rs 21.5 lakh for the project. The centre will include 10 beds for HIV patients.” He said the centre would motivate chronic patients whose families fail to support them in terms of treatment, besides giving them adequate diet. The official said work had already kicked off and the community care centre would open in the Red Cross building near Civil Hospital. He said a doctor, counsellor, three nurses, four outreach health workers, one part-time lab technician, along with a project coordinator and dietician had been appointed for the job. Notably, NACO is working on the oral substitution therapy for intravenous drug users so as to control incidence of HIV and for this, work on opening the drug addiction centre is going on. Dr Geetika Kansal, district aids programme officer said the move had been taken under NACO phase III and was aimed at chronic patients, who could not afford treatment. "
22,6,2010,Militants use HIV to fight UK troops in Afghanistan,http://timesofindia.indiatimes.com//world/uk/Militants-use-HIV-to-fight-UK-troops-in-Afghanistan/articleshow/6030024.cms," LONDON: In tactics that’s sure to pass as “dirty war”, the Taliban is using hidden needles to infect British troops with HIV. Hypodermic syringes are hidden below the surface pointing upwards to prick bomb squad experts as they hunt for devices, British newspaper the Sun reveals. The heroin needles are feared to be contaminated with hepatitis and HIV. And if the bomb goes off, the needles become deadly flying shrapnel. The tactic has been used in the Afghan badlands of Helmand, and was exposed by Tory MP and ex-Army officer Patrick Mercer. Conservative MP Patrick Mercer, a former army officer, exposed the tactic. “Are there no depths to which these people will stoop?” the Sun quoted him as saying. “This is the definition of a dirty war.” Not only syringes but razor blades are also being buried as the Taliban use increasingly “despicable” tactics. Protective Kevlar gloves have been issued to all Royal Engineer and Royal Logistic Corps bomb search teams. Lieutenant Colonel David Southall, Commanding Officer of the Counter-IED Task Force said: “Improvised explosive devices remain a tactic of desperation and last resort. “The Taliban know they can’t take us on and win in a conventional toe-to-toe fight – whilst they resort to some pretty despicable IED emplacement tactics,” he added. "
23,6,2010,HIV+ woman claims hosp denied her treatment,http://timesofindia.indiatimes.com//city/mumbai/HIV-woman-claims-hosp-denied-her-treatment/articleshow/6052362.cms," MUMBAI: A 34-year-old HIV-positive woman has alleged that doctors at the state-run G T Hospital forcefully discharged her on Tuesday morning and denied her treatment because of her medical condition. The hospital, however, refuted the allegations and said she had been treated there twice earlier. Goregaon resident Ayesha (name changed) was admitted to the medical ward of G T Hospital around 11 am on Tuesday. However, she was discharged within half-an-hour and asked to go to surgical department. Ayesha alleged that first, she got admitted to the hospital only after waiting in the rain for 5 hours and intervention by senior doctors. Secondly, she claimed that, instead of discharging her, the doctors could have simply transferred her papers from one department to another (surgery). What upset her the most was that a resident medical officer allegedly told her that her HIV-positive status could pose a problem for both patients and doctors. She also claimed that she was forcefully handed over the Discharge Against Medical Advice (DAMA) papers. ""There is an abscess in my neck that has to be operated upon but doctors want me to go to some other hospital. They are worried that the HIV may pass on to others,"" Ayesha said. Later in the evening, social workers shifted her to St George Hospital. It's been two years now that she has been living with HIV, while her husband succumbed to the same ailment seven months ago. The hospital, however, claimed that the issue was blown out of proportion by social workers. ""The patient had sought discharge against doctors' advice,"" said Dr A P Chaudhari, medical superintendent of G T Hospital. ""She was admitted to the wrong ward and I had asked my doctors to take her to the casualty and admit her again. We have many HIV+ patients and there is no reason to send her away."" "
24,6,2010,Antiretrovirals prevent HIV transmission,http://timesofindia.indiatimes.com//life-style/health-fitness/health-news/Antiretrovirals-prevent-HIV-transmission/articleshow/6058485.cms,"Giving antiretroviral drugs to HIV-infected mothers or giving HIV-fighting syrups to their babies are both effective in preventing transmission of virus through breastfeeding, a major international study has found. ""Our study found that both methods are effective in preventing HIV transmission. The antiretroviral regimen for treating the mothers is much more expensive and requires access to medical facilities that aren't widely available in developing countries such as Malawi, The baby regimen, in comparison, is incredibly cheap and much easier to implement. These findings are important because each year about 200,000 infants worldwide become infected with HIV through breastfeeding, and in the developing world infant formula is both prohibitively expensive and associated with increased infant deaths,"" the study's author Charles van der Horst said. In the study, 2,369 breastfeeding mother-infant pairs in Malawi, were randomly assigned to one of three groups -- a maternal antiretroviral therapy (ART) group, a second group in which infants were treated with nevirapine liquid and control group for whom medications were given at the time of delivery only. None of these women had developed AIDS yet and thus did not need treatment for their own health. After their babies were born, women in the maternal antiretroviral group received a single tablet twice a day containing the drugs zidovudine and lamivudine. They also received a dose of nevirapine by mouth once a day for 14 days and then twice daily from 2 to 28 weeks. Follow us on Twitter for more stories"
25,7,2010,NGO opens therapy centre for HIV patients,http://timesofindia.indiatimes.com//city/mysuru/NGO-opens-therapy-centre-for-HIV-patients/articleshow/6116159.cms," MYSORE: Asha Kirana, an NGO, has opened antiretroviral therapy centre to cater to the needs of HIV positive people in the region, at its hospital in Metagalli here recently. NGO chairman S N Mothi said people living with HIV can now get their ART medicine from the centre, where patients can also get laboratory tests done. He claimed that Asha Kirana has been adjudged as best community care centre by National Aids Control Organization (NACO). The centre has been set up in association with NACO and CII-Mysore. Senior health officer Raju, who inaugurated the ART centre said, the centre will facilitate over 1000 HIV positive patients. On the occasion, district aids prevention officer Dr Raghukumar claimed that the Asha Kirana is the only NGO in the state which has facilities like ICTC, modern lab with CD-4 testing, TB Dot centre and community care centre for HIV positive people. "
26,7,2010,Cells that fight HIV created,http://timesofindia.indiatimes.com//home/science/Cells-that-fight-HIV-created/articleshow/6128783.cms," PARIS: Lab work on mice has opened up a novel way of closing a gateway to the AIDS virus, according to a study published on Friday. The doorway in question is called CCR5, a protein that helps the human immunodeficiency virus (HIV) penetrate a cell, its first step before hijacking the cellular machinery and reproducing itself. Around a decade ago, scientists discovered that people who had a tiny gap in the genetic code for making CCR5 were surprisingly resistant to HIV infection and took more time to progress to AIDS. This gene variant, known as CCR5 delta 32, results in smaller CCR5 proteins, which prevents most strains of HIV from infecting the cell. Testing a theory, scientists in the US took immature haematopoietic cells—which make immune and red blood cells—from mice. They modified some of the cells, using a brand-new enzyme “cutter” to delete the famous CCR delta 32 section. As a result, when these cells matured and divided, they lacked the key code for making normal CCR5. The modified cells were reinjected back into the rodents, which were then exposed to HIV. Twelve weeks after infection, the animals had recovered their stock of immune T-cells and their levels of HIV were very low. But “control” mice that had not received the modified cells were highly infected and their immune systems weak. If the approach is found to be safe and effective on humans, it opens the way to creating a long-term generation of HIV-resistant T-cells in the body—in other words, a patient could suppress HIV without taking powerful antiretroviral drugs. The experiment headed by Paula Cannon of the University of Southern California, Los Angeles, and reported in the journal Nature Biotechnology, is the third avenue that has opened up for CCR5 investigators. Drugs that inhibit CCR5 are already being licensed as “salvage” therapy for patients whose immune systems have been crippled by HIV. Doctors are also testing in trials on volunteers a CCR delta 32 technique, but using T-cells as opposed to stem cells. “It’s a one-shot treatment if it works,” noted study co-author Paula Cannon, associate professor of molecular microbiology at the University of Southern California. In gene therapy, doctors try to coax the human body into doing something differently by tweaking its genetic structure. To treat HIV, the virus that causes AIDS, scientists have been experimenting with using gene therapy to boost the immune system. "
27,7,2010,HIV+ sex worker trapped sans medical aid,http://timesofindia.indiatimes.com//city/bengaluru/HIV-sex-worker-trapped-sans-medical-aid/articleshow/6129217.cms," BANGALORE: Sarala (name changed), a 38-year-old HIV-positive sex worker, was trapped for more than 10 days at the Beggars' Rehabilitation Centre at Sumanahalli. Her condition worsened after she didn't get regular ART treatment despite repeated pleas, says the Sex Workers' Union. Following this, the Karnataka Sex Workers' Union, with the support of human rights organizations, women's groups, HIV-positive networks and sex workers' units staged a protest in front of Beggars Colony. 'After getting calls to the crisis helpline, I visited the place. One can hardly call it a rehabilitation centre. I have got six sex workers released so far. But they were nabbed again and put in the Colony; one of them was HIV-positive. However, the colony doctor not only refused to treat her but also did not allow her to go to a hospital saying her being positive for HIV wasn't proved before him,"" charged Tejaswini, convener of Karnataka Sex Workers' Union. The doctor said he'd send her for testing on Monday and then decide if she needed to go to a hospital. But her health was deteriorating and she needed urgent medical attention, said Tejaswini. Human rights activist Manohar Elavarthi said: 'The past four months has seen a rise in violence against sex workers within the city as well as on the outskirts. These women are homeless but they are not beggars. It is the duty of the government to provide them housing."" ONE DOC FOR 1,700 INMATES 'We had no proof to say she was HIV-positive and we couldn't conduct any test as the centre is not equipped with necessary equipment. We asked the protesting NGOs to take her out by giving an application in a letterhead or with permission from the tahsildar. But they did not do so. After the protest, they gave an application seeking her release. According to our doctor, her condition was not worse,"" said C N Manjegowda, president, Central Beggars' Committee, that runs the Beggars' Rehabilitation Centre. 'From now on, we will check HIV status when we take beggars. If found positive, we will refer them for further treatment immediately,"" he said. 'Also, we have only one doctor to treat all 1,700 inmates and have no power to recruit doctors. The government has entrusted the healthcare of inmates to Karuna Trust, an NGO. I had discussed with the trust to appoint a gynaecologist for Beggars' Colony, but the plea is yet to be addressed,"" said Manjegowda. "
28,7,2010,"56 kids get HIV, hepatitis after blood transfusion",http://timesofindia.indiatimes.com//india/56-kids-get-HIV-hepatitis-after-blood-transfusion/articleshow/6160375.cms," JODHPUR: At least 56 children suffering from thalassaemia tested positive for HIV, hepatitis B and hepatitis C after receiving blood transfusion at government-run Umaid hospital in Jodhpur. They are among the 130 thalassaemic children registered with Jodhpur's Marwar Thalassaemic Society, said a source. In the last one-and-a-half years, at least eight thalassaemic children in the city were found to be HIV positive while 46 others were infected by hepatitis B virus prompting a probe by the state government. In December 2008, five children tested positive for HIV and 29 for hepatitis C virus. In May 2010, three more children were found HIV positive and 17 suffered from hepatitis C. According to the Thalassaemic Society, if all the children who received blood transfusion are tested, the numbers may go up. Unless new techniques for testing are introduced, the hazard will remain, felt society members. Recently, members met the principal of S N Medical College and the divisional commissioner and demanded nucleic acid test at Umaid Hospital blood bank to prevent infection during transfusion. Medical college principal R K Aseri said a proposal for nucleic acid test which is a more advanced blood test has been sent to Rajasthan government which is now studying the expenses involved. The college has also formed a three-member committee to probe if there are any flaws in the blood bank's testing methods. The Society also demanded special consideration for families below poverty line and adequate staff and resources at Umaid Hospital's thalassaemia ward. Society secretary Vipin Gupta said, ""We want the blood banks to have better technology.'' However, Raj Shree Behra, in-charge of Umaid Hospital's blood bank, said there is no way to reduce to zero the window period, that is the time taken for seroconversion after exposure to the HIV virus. Seroconversion is the development of detectable antibodies in blood to fight an infectious agent. It normally takes some time for antibodies to develop after the initial exposure to an infection. If infected blood has been taken from any donor before the formation of detectable antibodies, there is no technology which can detect them in the stored blood at any point of time, said Behra. Antibodies will develop only when the infected blood is given to any other person. Currently, ELISA test has a longer window period disabling it to detect any antibody at early stage in the donated blood. It is certified by National AIDS Control Organisation. "
29,7,2010,"56 kids get HIV, hepatitis after blood transfusion",http://timesofindia.indiatimes.com//city/jaipur/56-kids-get-HIV-hepatitis-after-blood-transfusion/articleshow/6161119.cms," JODHPUR: At least 56 children suffering from thalassaemia tested positive for HIV, hepatitis B and hepatitis C after receiving blood transfusion at government-run Umaid hospital in Jodhpur. They are among the 130 thalassaemic children registered with Jodhpur’s Marwar Thalassaemic Society, said a source. Terming it as a case of negligence, Union health minister Ghulam Nabi Azad said that the state government was responsible in the case. “It is a case of negligence. It is the responsibility of the state government to take proper precautions,” Azad said in Srinagar. In the last one-and-a-half years, at least eight thalassaemic children in the city were found to be HIV positive while 46 others were infected by hepatitis B virus prompting a probe by the state government. In December 2008, five children tested positive for HIV and 29 for hepatitis C virus. In May 2010, three more children were found HIV positive and 17 suffered from hepatitis C. According to the Thalassaemic Society, if all the children who received blood transfusion are tested, the numbers may go up. Recently, members met the principal of S N Medical College and the divisional commissioner and demanded nucleic acid test at Umaid Hospital blood bank to prevent infection during transfusion. Medical college principal R K Aseri said a proposal for nucleic acid test — which is a more advanced blood test — has been sent to Rajasthan government which is now studying the expenses involved. The college has also formed a three-member committee to probe if there are any flaws in the blood bank's testing methods. The Society also demanded special consideration for families below poverty line and adequate staff and resources at Umaid Hospital's thalassaemia ward.Society secretary Vipin Gupta said, “We want the blood banks to have better technology.'' Currently, ELISA test has a longer window period, disabling it to detect any antibody at early stage in the donated blood. Window period is the time taken for seroconversion ater exposure to the HIV virus. tnn &amp; agencies "
30,7,2010,4 HIV +ve patients face eviction from their home,http://timesofindia.indiatimes.com//city/hyderabad/4-HIV-ve-patients-face-eviction-from-their-home/articleshow/6161180.cms," HYDERABAD: Four HIV positive residents of a colony in Saroor Nagar are just one week away from being thrown out of their home. Reason: the residents welfare association has taken objection to their medical condition and ordered them to leave, with the alleged aid of local police. The apartment located in HUDA complex, Saroor Nagar is owned by a social worker, B S H Prasad and acts as a shelter for HIV positive people who are trying to lead a normal life. The home currently houses three students enrolled in leading professional colleges in the city and a lecturer of a private junior college in Guntur. According to the owner of the apartment, trouble started when the president of the residents welfare association, Srilatha, chanced upon posters on HIV awareness inside the apartment, where the four lived, around two weeks ago. She spread the word among the neighbours and in the enquiries which ensued, two of the four residents of the flat revealed their medical condition. Following this, the resident welfare association threatened the students and asked them to vacate. When they did not oblige, 16 of the 32 house owners of the residential complex gathered signatures complaining against their stay and approached the Saroor Nagar police station for help in evicting them. ""The police did not lodge any case but an SI, Naresh asked the four residents to leave the place. When they objected, he threatened them of dire consequences,"" said Prasad, activist and house owner, who has now moved the State Human Rights Commission against the residents welfare association. Responding to the issue, human rights and anti-stigma activists said that the residents welfare association of the complex and the police who allegedly threatened the HIV patients can be booked under the HIV AIDS Bill 2007. ""The right to privacy and right to lead a public and cultural life of all the four patients were denied in this case. Those responsible for publicising their medical condition and threatening them to vacate the place on the basis of their medical condition can be taken to court. It is a shame that such a thing happened in the city,"" said G Jagdeesh Kumar, former sate manager of Telugu Network of People Living with HIV AIDS (AP) and activist. Meanwhile, Cyberabad police officials denied that any of their personnel threatened the inmates of the house. Police, however, admitted that a complaint had reached the Saroor Nagar police station from the residents association a fortnight ago. ""No action was taken. We advised them to solve the issue among themselves,"" a police official said. Activists, however, pointed out that the police could have taken action against the association. ""Instead of trying to solve the issue the police should have booked the residents welfare association as they were open about their bias,"" said M A Shakeel, coordinator, Human Rights Law Network. "
31,7,2010,HIV+ status drives woman to end life,http://timesofindia.indiatimes.com//city/goa/HIV-status-drives-woman-to-end-life/articleshow/6161235.cms," PANAJI: A 38-year-old woman from Pernem jumped to her death from the first floor of Goa Medical College and Hospital (GMC) on Monday morning after being told that she was HIV positive, her relatives have claimed. However, the hospital's medical superintendent Dr Rajan Kuncolienkar refused to confirm if the woman was HIV positive. ""I have not seen her case papers so I do not know,"" he said. The woman, a widow, was admitted to GMC on July 9 and was undergoing treatment for an enlarged liver and spleen, GMC sources said. She was initially brought to GMC for tests as she was not keeping well despite continuous medication. Sources said the woman was suffering from depression after a doctor told her about her status on Saturday. The sources added that the mandatory counselling was not done. "
32,7,2010,HIV+ woman commits suicide on being told of infection,http://timesofindia.indiatimes.com//city/goa/HIV-woman-commits-suicide-on-being-told-of-infection/articleshow/6167786.cms," PANAJI: A HIV-infected woman committed suicide by jumping from the first floor of state-run hospital's on being told about the infection. ""We are inquiring into the incident. We can't make detailed statement at this juncture but we are probing it,"" Health Minister Vishwajit Rane told reporters today. The 38-year-old woman jumped to death from the first floor of the building of Goa Medical College here yesterday when she was allegedly told about her HIV positive status. GMC Dean Dr V N Jindal said National Aids Control Organisation (NACO) has written a letter to the Home Ministry seeking details of the case. The woman was admitted to GMC on July 9 and was undergoing treatment for an enlarged liver and spleen. Hospital sources said she was initially brought to GMC for tests as she was not keeping well despite continuous medication. "
