,month,year,name,link,article
119,9,2011,HIV+ve dumped outside LNJP,http://timesofindia.indiatimes.com//city/delhi/HIVve-dumped-outside-LNJP/articleshow/10024940.cms," NEW DELHI: Painful shrieks ring out from under a white sheet in the Neurosurgery Emergency ward of LNJP Hospital . It’s a destitute woman crying out for help. HIV-positive , disoriented, and bearing a gaping wound infested with maggots, the 40-year-old woman was found on a street outside the hospital last Monday. The case has again highlighted the plight of mentally unstable destitutes left on the capital’s streets to fend for themselves. When TOI visited the hospital on Saturday, the woman was lying on a bed with a sheet draped over her head. Records show she was earlier treated at the hospital’s ENT department for a severe ear infection and then taken away by an NGO. But this time, she was found dumped outside the hospital, disoriented and sick, with maggots digging into a severely infected wound behind her ear. Sources said the woman had been put through neurological tests and will need regular dressing for her wounds till all the maggots are cleared. Till then, a question mark will hang over her nutrition. Since she is admitted to the emergency ward, there is no arrangement for meals, and her nutritional requirements are not being met as per her physical status, sources said. “She is surviving on intravenous fluids. The staff members have been buying food to feed her off and on,” the source added. LNJP medical superintendent Dr Richa Dewan denied any negligence in the treatment of the destitute woman. “We found her outside our hospital on September 12. She was very sick. But we have admitted her and have managed to give her every possible treatment . But till the maggots are cleared we cannot think of any other kind of intervention. After this problem is solved, we will start her on anti-retro viral treatment (for HIV) and look into her psychiatric needs. She is being kept in the emergency, as it a place where she can be looked after better,” Dewan said. On what the government proposes to do for the growing number of destitutes on the streets, minister for health and family welfare, Kiran Walia, said she was concerned. With no ready solution to offer, the minister said her department was planning to set up two halfway homes for the homeless who are in need of long-term care, and also a hospice for elderly destitutes. "
120,9,2011,"HIV patient denied treatment, moves court",http://timesofindia.indiatimes.com//city/kochi/HIV-patient-denied-treatment-moves-court/articleshow/10059931.cms," KOCHI: Patients infected with Human Immunodeficiency Virus (HIV) are being denied treatment by hospitals in the State, points out a petition before the Kerala High Court. The case will be heard by Chief Justice J Chelameswar and Justice PR Ramachandra Menon on Wednesday. Foundation for Integrated Research in Mental Health, a voluntary health organization based at Thiruvananthapuram, has taken up the case of an HIV positive patient who was denied treatment by a private hospital at Thiruvananthapuram and is moving a petition before the high court challenging the stances taken by the National Human Rights Commission (NHRC) and Kerala State Aids Control Society (KSACS) towards the treatment denial. Ashok Nair, who is HIV positive, was denied treatment when he was taken to Cosmopolitan hospital at Thiruvananthapuram after he suffered multiple fractures in a traffic accident. He was advised of the need for urgent surgery as he had suffered multiple fractures and was taken to the trauma care wing of the hospital. Ashok told the hospital staff that he was HIV positive. Upon learning that he was HIV positive, the hospital authorities denied to provide treatment to him and referred him to the Medical College Hospital of Thiruvananthapuram. Ashok approached the human rights commission questioning the hospital's denial of treatment. KSACS enquired into the incident and submitted a report that accepted the hospital's stance that the patient was sent back as he was in need of surgery for which the hospital didn't have facilities. When the petition by Ashok was considered by NHRC, it accepted KSACS' report and dismissed allegations of treatment denial.The petitioner alleges that the explanation by the hospital is not credible as their website boasts of a specialty clinic for orthopaedic and trauma care."
121,9,2011,Awareness alone can reduce HIV/AIDS cases,http://timesofindia.indiatimes.com//city/varanasi/Awareness-alone-can-reduce-HIV/AIDS-cases/articleshow/10061780.cms," VARANASI: Migrating population remains most vulnerable to HIV infection. While growing need for spreading awareness among high risk groups like commercial sex workers and migrant populations was highlighted during the one-day visit of director general (DG) of NACO, Aradhana Jauhari, to various ART centres in the city on Tuesday, the changing dynamics of HV/AIDS in east UP and Bihar regions of the country also attracted attention on the occasion. ""Awareness holds the key for curbing the menace of HIV in eastern UP region and parts of Bihar that have now become the high priority areas for National AIDS Control Organisation NACO,"" said Jauhari while talking to TOI after visiting the ART centre at Banaras Hindu University (BHU) on Tuesday. Saying that the invisible killer has continued to spread its tentacles in the Hindi speaking states like UP, Bihar, MP and Rajasthan, she stressed that the selected pockets of east UP and Bihar with high migrant population remain high risk zones in the country. Apart from Varanasi, Jaunpur and Ghazipur, other pockets like Azamgarh-Bhiwandi-Mau and Patna-Muzaffarpur in Bihar have a good number of migrating people who are infecting their family members and local population with the HIV virus. There is an urgent need to spread awareness among the high risk groups of migrant population and devise a strategy to effectively address the issue, she said. It may be mentioned here that the DG of NACO visited ART centres of BHU, SPG Divisional Hospital and DDU Hospital besides holding a meeting of UP NACO officials and other senior district health officials in the day. Stressing the fact that prevention is the only cure in this case, the DG said that eastern UP and Bihar states could learn from the experiences of Tamil Nadu and other southern states that have shown reversal in the trend with receding cases in the last few years. Similarly, advocating for establishment of more ART centres in east UP and Bihar, she also maintained that counselling, support and care services offered through ART centres including integrated counselling and testing centres (ICTC) and voluntary counselling and testing centres (VCTC) need to play pro-active role in spreading awareness. The overall prevalence rate of HIV infection has reduced to 50% in the last one decade, but still the figure is high particularly in the Hindi speaking states. A prevalence rate of 0.3% is far from satisfactory and much work is yet to be done to bring it further down, she added."
122,9,2011,AIDS patient shunned after health workers reveal HIV positive status,http://timesofindia.indiatimes.com//city/ahmedabad/AIDS-patient-shunned-after-health-workers-reveal-HIV-positive-status/articleshow/10111705.cms," An AIDS patient has alleged that he has become a victim of severe discrimination after health workers revealed his HIV positive status to his villagers. Raju, whose full name has been withheld to protect his identity, said that villagers have started shunning him and his family afetr the revelation. His wife and two children were diagnosed with HIV a year ago. Raju helps in mobilizing HIV suspected patients to get tests done and prevent the spreading of the virus from parents to children. He said that it was illegal to disclose the HIV status of any patient. “But the local anganwadi workers disclosed my HIV positive status to a health worker, who in turn spread the word in my village. Now, people look at me with suspicion” , complained Raju. "
123,9,2011,Health dept takes action against illegal sale of HIV testing kits,http://timesofindia.indiatimes.com//city/pune/Health-dept-takes-action-against-illegal-sale-of-HIV-testing-kits/articleshow/10120220.cms," PUNE: The incident of Illegal sale of HIV testing kits, meant for the Integrated Counseling and Testing Centres (ICTC), to private laboratories has jolted the state health officials into action. An alert was sounded in the state after a counsellor attached with an ICTC in Ichalkaranji was recently nabbed selling the kit, which is given free by the National AIDS Control Organisation (NACO) to government-run testing and counselling centres across the country. ""Any kind of illegal activity in respect of HIV testing kit will not be tolerated. We have asked all officials involved in testing and counselling work to be wary of such an activity happening on their premises. The counselor, who was nabbed selling the kit in Inchalkaranji has been dismissed from service,"" said Dilip Deshmukh, additional project director, Maharashtra State AIDS Control Society. The case of illegal sale of HIV testing kits came to light in Kolhapur district on September 19, Deshmukh said. ""I received a tip that one person in Ichalkaranji is selling the kits to private laboratories. After checking the information from other sources, we laid a trap. Some of our officials were sent to Ichalkaranji. They approached the person and expressed willingness to purchase the kit. The person, in turn, called up another man who would procure the kits for sale. The man came there and asked for Rs 5,000 for 100 kits. The officials negotiated and purchased 100 kits for Rs 4,000. The culprit turned out to be a counsellor who worked with an ICTC centre in Ichalkaranji."" ""We have dismissed the counsellor from service from September 20. A complaint has been registered with the police,"" Deshmukh added. An ICTC is a place where a person is counselled and tested for HIV, on his own free will or as advised by a medical provider. There are now more than 4,000 counselling and testing centres in India, mainly at government hospitals. In Maharashtra, there are 578 ICTCs where testing and counselling is provided free. The main functions of an ICTC are conducting HIV diagnostic tests, providing basic information on the modes of HIV transmission, promoting behavioural change to reduce vulnerability, and link people with other HIV prevention, care and treatment services. ""The Maharashtra State AIDS Control Society receives the HIV testing kits from NACO. From there the kits are distributed to civil surgeons of 33 districts who, in turn, supply them to the ICTC centres in their jurisdictions,"" Deshmukh said."
124,9,2011,11L collected for HIV-infected thalassemic kids,http://timesofindia.indiatimes.com//city/rajkot/11L-collected-for-HIV-infected-thalassemic-kids/articleshow/10161982.cms," RAJKOT: The Congress party has raised Rs 11 lakh for the 23 thalassemic children who contracted HIV after transfusion of contaminated blood in the Civil Hospital of Junagadh. ""We have appealed to public to come forward to help the families of these 23 kids. Within two days, we got an overwhelming response from the public and received Rs 11 lakh. We have organized an event on October 2 at A G School campus where the funds will be distributed among the victims' families,'' deputy mayor, Junagadh Municipal Corporation (JMC), Girish Kotecha said. JMC is the only municipal corporation where the Congress is in power. ""We are hopeful that we would be able to give Rs 1 lakh to each of the 23 kids' families,'' Kotecha said. Interestingly, JMC recently passed a resolution announcing Rs 21,000 support to each of these kids. ""Most of them (kids) come from economically weak backgrounds and we demand that the state government give them Rs 5 lakh as compensation as they contracted HIV due to the government's negligence,'' Kotecha said. The incident came into light three weeks ago from Junagadh Civil Hospital where around 100 children from nearby area get regular blood transfusion. Parents have alleged that their children were infected with HIV positive during blood transfusion at the hospital. But the government denied it saying children may have got infected elsewhere. After the incident came to light, Government sent a team to probe into this matter. ""We are awaiting the report of the team. We will take this issue before the central government. Victims' family members have formally lodged complaints in police station and police have taken them as applications and not as an FIR.'' said Kotecha."
125,10,2011,State AIDS counsellor caught for trying to sell free HIV test kits,http://timesofindia.indiatimes.com//city/mumbai/State-AIDS-counsellor-caught-for-trying-to-sell-free-HIV-test-kits/articleshow/10212125.cms," MUMBAI: In an incident that has shocked the agencies fighting HIV/AIDS in the state, the facilitators themselves were caught indulging in malpractice and trying to make a fast buck by selling HIV testing kits that are supposed to be given free of cost to counselling centres. A corrupt counseller was arrested last week and both he and a lab technician, also involved in the alleged racket, have been dismissed from their job. The incident came to light when Maharashtra State Aids Control Society (MSACS) officials in Mumbai were informed that outreach workers of an NGO in Kolhapur were trying to sell HIV testing kits. The rapid testing kits, which can reveal an individual's HIV status in less than 30 minutes, is provided to the MSACS by the National Aids Control Organisation (NACO) for free. The MSACS later distributes the kits to its 578 integrated centre for counselling and testing (ICTC) centres across the state. On getting the information, the MSACS officials decided to nab the culprits. Once the investigation started, the officials found that one of their own counsellors, Raghunath Kamble, and lab technician Hemlata Patil were the masterminds and the NGO workers were mere mediators. Additional project director Dr Dilip Deshmukh, who helped nab the culprits with the help of MSACS officials from Kolhapur, told TOI that the incident was shocking and something that the agency had never witnessed. ""The culprit has been handed over to the police and a case has been registered. We are now checking if such a racket exists in other parts of the state,"" he said. District superviser of Kolhapur Niranjan Deshpande was the first one to learn about the racket. Subsequently, on finding that Naagsen Kamble, an outreach worker from Lotus Medical Foundation, was trying to sell the testing kits to private labs, Deshmukh sent some officials as decoy customers. These officials contacted Naagsen, who on September 19 called them to say the deal would be sealed in a hotel at Jaysinghpur, a small town in Kolhapur. ""As our officials, posing as customers, reached the hotel, they found that it was one of our counsellors, Raghunath, who was trying to sell the kits,"" said Deshmukh, adding that he offered Rs 5,000 for two kits, which can conduct up to 100 tests. Deshmukh then contacted the police who arrested Raghunath. During his interrogation, the counsellor told the police that lab technician Hemlata also had some testing kits at her home. ""Hemlata's house was searched and around 30 kits were recovered from her refrigerator,"" added Deshmukh. He said both Raghunath and Hemlata had been dismissed from MSACS. ""We have asked other agencies to be extra cautious,"" he added. A Mumbai District Aids Control Society official said following the latest ""bust-up"", they have given out stricter orders on the already stringent protocols about the distribution and use of the kits to curb any such incident in future."
126,10,2011,Thane collector extends aid to poor HIV+ve persons,http://timesofindia.indiatimes.com//city/mumbai/Thane-collector-extends-aid-to-poor-HIVve-persons/articleshow/10273851.cms,"Mumbai: A month ago, low-profile Thane collector A L Jarad embarked on a novel mission to provide financial assistance to HIV-positive persons, particularly those below the poverty line. “It was a difficult task, but we accomplished it. We have sanctioned financial aid of Rs 600-Rs 800 to around 550 people from the scheme for the destitute,” Jarad said on Friday. During his routine camps in rural Thane, Jarad found that most of the HIV-positive people were facing a financial crisis and owing to the stigma, they were unable to take up physical work. Subsequently, in collaboration with the public health department, Jarad personally conducted a survey of the district. However, HIV-positive people were reluctant to come forward to accept financial assistance. As a special measure, teams were sent to the homes of 550 persons to complete the formalities for the scheme. “We sent out teams to 15 tehsils and identified the beneficiaries, provided them proof of residence, income certificate and civil surgeon’s certificate. Later, we submitted the papers to a high-level committee, which quickly approved the financial assistance,” Jarad said. In Thane district alone, there are 12,000 persons undergoing treatment for HIV, but not all, are eligible. At the state level, a senior public health department official said, there were 4.2 lakh HIV-positive cases. “Of these, over one lakh are below the poverty line. The government should extend the Thane exercise to the entire state,” he said. Of the 4.2 lakh HIV+ve cases in Maharashtra, over a lakh are below the poverty line. The government should extend this exercise to the entire state. "
127,10,2011,HIV positive rate lowest ever,http://timesofindia.indiatimes.com//city/goa/HIV-positive-rate-lowest-ever/articleshow/10299228.cms," PANAJI: Over the last four years, 4,453 HIV/AIDS cases have been reported in Goa, and 453 fatalities due to the disease have been recorded during the same period. The HIV/AIDS positive rate in the state, however, is at an all time low, even as the number of people testing for HIV/AIDS is the highest ever. Between 1986 and 2011, over three lakh persons have undergone the test to check for their HIV status in Goa. Of these, 13,913 individuals have tested HIV positive and 1,453 have resulted in AIDS cases to date. The number of male AIDS patients in Goa, between 1986 and 2011, has been more than double at 1,009 of the 444 females detected with the ailment. The highest number of HIV positive cases were reported in Goa in 2007. The number of cases came down to 1,019 in the following year and to 959 in 2009. Last year, the HIV positive cases came further down to 821 and to 459 this year till August. The positivity rate has also come down from 13.41% in the late '90s to 4.77% in 2007 and just 1.86% in 2011 so far. The number of persons testing for HIV, however, has grown exponentially from just 2,279 in 1995 to as much as 18,380 by 2006. The number went up further to 26,737 in 2008 and touched an all time high in the following year to 33,473. In the present year, already 24,691 persons have tested for HIV up to August. This increase in numbers can be attributed to increased awareness of the ailment brought about through state and central government efforts. Over the years, the Goa State Aids Control Society (GSACS) has set up Integrated Counseling and Testing Centers (ICTCs) in three private hospitals in addition to 14 ICTCs operational in government hospitals. An ICTC is where a person goes for counseling and testing for HIV. The person comes entirely of his/her own will or as advised by a medical practitioner. The ICTCs provide HIV testing with pre-test and post-test counseling, drugs for opportunistic infections, free distribution of condoms and follow-up counseling for HIV positive cases through field visits. The centres also provide testing, pre-test and post-test counseling to pregnant mothers who come for ante-natal check ups. Those who test positive are provided psycho-social support and linked to treatment and care."
128,10,2011,Government project prevents 1 lakh fresh HIV cases in five years,http://timesofindia.indiatimes.com//india/Government-project-prevents-1-lakh-fresh-HIV-cases-in-five-years/articleshow/10308234.cms,"NEW DELHI: About 100, 000 fresh HIV cases among the general population were averted in India in five years by targeting the most vulnerable section. A study — conducted jointly by the Institute for Health Metrics and Evaluation, University of Washington, University of Hong Kong and the Public Health Foundation of India (PHFI) — has found that Avahan successfully slowed the transmission of HIV among the general population by raising the coverage of prevention interventions in high-risk groups like female sex workers, their clients and partners, men who have sex with men (MSM), intravenous drug users and truck drivers. Launched in 2003, Avahan received $258 million from the Bill and Melinda Gates Foundation, and complemented the government’s own efforts on HIV prevention. The programme was implemented in four large states — Andhra Pradesh, Karnataka, Maharashtra and Tamil Nadu — and two small northeastern states of Manipur and Nagaland. These six states were estimated to have the highest HIV prevalence in India in 2003, and a total population of 300 million. The study, “Assessment of population-level effect of Avahan, an HIV-prevention initiative in India,” published in the British Medical Journal, The Lancet, says interventions like safe-sex counselling by peers, clinical services like treatment for sexually transmitted infections, distribution of free condoms and needle and syringe exchange programmes among the most-at-risk population prevented the virus from spreading among the general population. Lead author of the study Professor Lalit Dandona from the PHFI told TOI that HIV mainly spread in India through sexual intercourse. He said, “High-risk population like sex workers would infect their clients who would then spread it to other female partners like their wives. Similarly, MSMs infected each other and then spread it within the general population through unprotected sex. Avahan showed us that by targeting high-risk groups, the virus spread among the general population can be controlled.” He added, “HIV prevalence among the general population saw a significant reduction in Andhra Pradesh, Karnataka and Maharashtra due to Avahan. There wasn’t a very high difference in Tamil Nadu, while there was no significant change in the two northeastern states.” India has an estimated 2.4 million living with HIV, making it one of the largest infected populations in the world. "
129,10,2011,"HIV project averted 100,000 infections in India: The Lancet",http://timesofindia.indiatimes.com//india/HIV-project-averted-100000-infections-in-India-The-Lancet/articleshow/10313178.cms,"LONDON: More than 100,000 fresh HIV cases have been averted over the last five years among the general population in India which has some 2.4 million people living with the virus, according to a study in 'The Lancet' journal. This is all thanks to a Bill &amp; Melinda Gates Foundation -funded US dollars 338 million project, called Avahan, which was launched in six Indian states of Tamil Nadu, Karnataka, Andhra Pradesh, Maharashtra, Manipur and Nagaland in 2003. Avahan was launched for the purpose of reducing the spread of HIV in India and developing a model prevention system to encourage others worldwide to adapt and adopt it. The project serves the groups that are most vulnerable to HIV infection, including sex workers, their clients, high-risk men who have sex with men, and injecting drug users in the six Indian states with an estimated population of 300 million. All these six states had the highest prevalences of the human immunodeficiency virus (HIV) in India in 2003, according to the study conducted by the Institute for Health Metrics and Evaluation, University of Washington, University of Hong Kong and the Public Health Foundation of India. The study says interventions like safe-sex counselling by peers, treatment for sexually transmitted infections, distribution of free condoms and needle and syringe exchange programmes among the most-at-risk population prevented the virus from spreading among the general population. ""Overall, we estimated that 100,178 HIV infections were averted at the population level from 2003 up to 2008 as a result of Avahan,"" the study's author say. Lead author Prof Lalit Dandona at the PHFI, added: ""HIV mainly spreads in India through sexual intercourse. HIV prevalence among the general population saw a significant reduction in AP, Karnataka, Maharashtra due to Avahan. There wasn't a very high difference in Tamil Nadu, while there was no significant change in the two northeastern states."" "
