,month,year,name,link,article
48,4,2011,4 HIV+ students thrown out of Guj schools in last 3 years,http://timesofindia.indiatimes.com//city/ahmedabad/4-HIV-students-thrown-out-of-Guj-schools-in-last-3-years/articleshow/8041765.cms," AHMEDABAD: All the AIDS awareness drives seem to have come to a naught, at least in some schools of Gujarat. This matter was highlighted in Parliament recently that HIV infected children continue to face discrimination even in their schools. The government has told Lok Sabha in reply to a question that 61 students were thrown out of schools in the country over the last 3 years and of these, four HIV positive students were from Gujarat. Apart from these four, there was also one incident of discrimination reported from Ahmedabad. However, complaints and timely action by the officials prevented the students from moving out of the schools. The government quoted National AIDS Control Organization (NACO) in saying that these 61 children infected by HIV were removed from the schools in various instances during 2008-2010. The discrimination cases were reported from Andhra Pradesh, Gujarat, Haryana, Kerala, Maharashtra, Uttar Pradesh and West Bengal. The central government said that advocacy programs are conducted to sensitise principals and teachers to ensure that students with HIV/AIDS are treated with dignity and respect. National AIDS control Organization (NACO) and State AIDS Control Society along with their state and district level networks also conduct advocacy programmes with various stakeholders including school principals and teachers. Dr Pradeep Kumar, additional project director Gujarat State AIDS Control Society admitted that such incidents have taken place, but the state had ensured that these students were back to the schools. Pratik Raval, coordinator, Greater Involvement of People living with AIDS says that of the four incidents, one was in Mehsana, one in Rajkot and two in Bhuj. About the Ahmedabad incident he said that the incident was averted due to advocacy by the officials. He further said that since 2008, there have been no such incidents. The state education department has already issued a directive warning of stern action against the school involved in such cases. case of a circular stating that if there was a repeat of such incidents in any of the schools in the state, the state would immediately cancel the recognition of such schools. He said that after these incidents several other initiatives have been taken for such students. State - Students thrown out from school Andhra Pradesh - 27 West Bengal - 13 Haryana - 9 Gujarat - 4 Kerala - 4 Uttar Pradesh - 3 Maharashtra - 1 TOTAL 61 "
49,4,2011,'Stigma prevents access to HIV services’,http://timesofindia.indiatimes.com//city/pune/Stigma-prevents-access-to-HIV-services/articleshow/8043102.cms," PUNE: The two-day state-level convention of MSM (men having sex with men), Saptarang (Rainbow), that concluded in Panhala on Wednesday had participants unanimously asserting that the stigma, discrimination and criminalisation faced by the community prevent universal access to HIV prevention services, treatment, care and support. Darshana Vyas, project director, Pathfinder International, said, ""The convention was held at Panhala (Kolhapur district) and was an attempt to re-energise the MSM community, strengthen community feeling and leverage greater leadership and involvement in project governance and implementation."" She said that community-based organisations (CBOs) formed so far, have to gradually evolve into a state-level federation acting as a constant support to the community and giving voice to their issues. ""We not only need to ensure that the community is made part of the mainstream, but also continue and scale our efforts to reach the unreached."" The convention was organised by Pathfinder International which has been implementing the Mukta project to reduce prevalence of sexually transmitted infections (STIs) and HIV/AIDS among the most at risk populations such as female sex workers (FSW), MSMs and their partners. Now working in five districts of Maharashtra, the project seeks to transition the management and implementation of the HIV programme to CBOs. The convention held at Panhala brought together around 300 community members from six districts of Maharashtra, namely Kolhapur, Latur, Nasik, Beed, Pune and Yavatmal where CBOs have been formed. Various groups and institutions working with the MSM community such as Samabhavana Society, Samapathik and Udaan also attended the convention. The event included guided discussions on strengthening communication for behaviour change, raising awareness on human rights, entitlements and imparting micro-planning, leadership and team-building skills. Sameer Kumta, from the Bill and Melinda Gates Foundation that supports HIV prevention programmes in the districts, underlined the need for leadership from within the community and called upon the members to take ownership of the work and share responsibilities. ""It is only through collective efforts that we can address newer challenges, while contributing effectively towards bringing down the HIV prevalence rates,"" he said, adding that the convention was a platform to rethink the communication, leadership and management strategies for a stronger community-led HIV response. Kumar (name changed) a Kolhapur-based peer educator, said, ""Coming together proved helpful in understanding how we can collectively address issues such as adherence to ART, consistent condom use, diagnosis and treatment of STIs, voluntary HIV testing, etc. We hope to carry home learnings from this workshop and use it to reach out to the community at our level."" In the session on legal literacy, participants were informed about rights of the community and applicable legal provisions. Raju, another MSM from Latur, while sharing his learning from the session, said there are some laws that criminalise sexual acts between members of the same sex. ""We must collectively challenge such laws and policies that abuse human rights and limit fundamental freedom,"" he said. Pathfinder International has facilitated FSW and MSM CBOs in Kolhapur, Latur, Nashik, Beed, Pune and Yavatmal districts and has successfully handed over six district interventions to the Maharashtra State AIDS Control Society as part of the third phase of the National AIDS Control Programme (NACP III). The project has been successful in decreasing STI rates among FSWs and MSM by over 30% in the last five years. The convention, Saptarang (Rainbow), held at Panhala brought together around 300 community members from Kolhapur, Latur, Nashik, Beed, Pune. "
50,4,2011,Most HIV-hit kids lose parents to AIDS,http://timesofindia.indiatimes.com//city/mumbai/Most-HIV-hit-kids-lose-parents-to-AIDS/articleshow/8095008.cms," MUMBAI: More than half the HIV-positive children in Maharashtra have lost one of their parents to the disease and a high number have lost both their parents. According to a study done by CHAHA, a care and support programme for children affected with HIV, Maharashtra ranks high in the list of states that have more than two HIV positive members in a family. Between June 2007 and March 2011, CHAHA reached out to a total of 64,056 children and families affected by HIV and AIDS in the states of Andhra Pradesh, Tamil Nadu, Maharashtra and Manipur. Out of these, 38% of families were found to be headed by women, many of who had to turn to prostitution to sustain their families. ""There were a total of 21,000 HIV positive children in the ten districts of Maharashtra, 52% of which had lost one of their parents to the disease and 17% had lost both their parents. The numbers were higher than that of the other three states,"" said Manoj Pardeshi, general secretary of Network of Maharashtra for people living with HIV. It was also found that the status of children remains unknown especially after the death of their parents. ""It is only when the child gets an infection and falls ill, that he/she is taken to a hospital and it is there that their HIV status is found out. Because of the delay in detection, most of the time, even the treatment is delayed,"" said Sonal Mehta from HIV/AIDS Alliance India. ""A total of 13,001 children were encouraged to go for HIV tests by the programme, of which about 11% were found to be positive,"" she added. The programme found that the needs of the HIV positive people were different and everything could not be provided by the anti-retroviral therapy (ART) centres. ""For example, those children who were young are now growing up to be adolescents. Their needs are different and they have to be counselled differently from the ten-year-olds’”. In an ART centre, which provides the medicine, this kind of counselling is not available. We go from house to house and work on a personal level,"" said Shabana Patel from the National AIDS programme. The programme, which had been running on global funds, is now struggling to carry on with the work with HIV-affected families. ""The funds were given to us for five years in dollars. But since the value of dollars fell, the funds have got over in three years itself. We have asked for help from the National AIDS Control Program (NACO) and the Central government,"" Patel said. "
51,4,2011,HIV positive population on the rise in Rajasthan,http://timesofindia.indiatimes.com//city/jaipur/HIV-positive-population-on-the-rise-in-Rajasthan/articleshow/8121222.cms," JAIPUR: Rajesh (name changed) had gone to donate blood to fulfil a social obligation at a camp organised here but he was completely shattered when the blood he donated was found to be HIV positive. His incident has brought to the fore the grim reality of the high prevalence of HIV positive people in the state who are not aware of their status. The recently released data of people, who donated blood in the last one financial year in the entire state, shows that among the donors as many as 819 were HIV positive. These people are not aware of the fact that they are carriers of the virus. All donated bloods are subjected to laboratory tests and if found HIV positive, are completely destroyed. Statistics show that there are 83 registered blood banks in the state, which collect blood through camps and also through replacement. In the last financial year, around 555 people went to the camps orgainsed by social organizations, hospitals and blood banks and donated blood voluntarily. Of the 4,57,304 people who donated blood from April 2010 to March 2011, 819 donors were found positive for HIV implying that one out of 558 people, who donated blood was carrying the AIDS virus. According to the Rajasthan State Aids Control Society, transfusion of HIV-infected blood is also a major reason for transmission of the virus. The society stated that one should take blood only from a licenced blood bank where it is tested for HIV. Jaipur, which has highest number of blood banks in the state, found 326 such cases registered in the last financial year. In Jodhpur, such cases were recorded at 90, Ajmer 47, Alwar 44, Bhilwara 27, Udaipur 40 and in Bikaner 25 such cases were found. In 2008, around 3,90,899 people had donated blood out of which 764 were HIV positive, and in 2009 the figure increased to 808, in the same year 3,94,917 people had donated blood. The state government is now taking the issue seriously and kick-started awareness campaigns on HIV/AIDS where folk artistes were roped in to interact with people in their local dialects on the requisite precautions to be taken for the disease. "
52,5,2011,HIV+ to get blood free of cost,http://timesofindia.indiatimes.com//city/lucknow/HIV-to-get-blood-free-of-cost/articleshow/8130329.cms," LUCKNOW: In a major relief to HIV+ and those suffering from diseases like haemophilia, thalassemmia, sickle cell anaemia, the state government has decided that they can get blood and its components free from all government and National Aids Control Organisation (NACO) supported blood banks. Most of these blood banks are based in the government hospitals and medical colleges/institutions. A government order relating to blood and blood products was issued recently. The order mentions the category of patients who can procure blood and its components free of charges. The category also includes destitute, patients from below poverty line, pregnant women admitted under the Janani Suraksha Yojana, prisoners and disabled. ""The decision aims to cut procedural crap to save the lives of persons in need,'' Mani Prasad Mishra, special secretary, who issued the GO, said. Mishra also headed the committee which recommended changes in the government blood and component availaibility policy. ""The said order is going to be of great help to all those who need blood frequently and in large quantity,'' Vinay Manchanda of Haemophilia Society of India said. The committee comprising director generals of medical education and health, joint director, UP State Aids Control Society (UPSACS), Dr Ashok Shukla, consultant blood safety, UPSACS, Dr Dheeraj Khetan, head, Ram Manohar Lohia Hospital, Dr RS Dubey, incharge blood bank, Chhatrapati Shahuji Maharaj Medical University Dr Tulika Chandra also recommended slashing rates of blood and blood components for other patients. As per the revised rate, a unit of packed red blood cells (PRBC) and whole blood would cost Rs 400. A sum of Rs 200 has been fixed for a unit of fresh frozen plasma and random donor platelets concentrate. Blood component,cryoprecipitate, would be available at Rs 100. A universal rate of Rs 850 for blood and its components was fixed by National Blood Transfusion Committee (NBTC) in April 2008. However, the decision invited ire, specially when seen in the context of government and NACO supported blood banks. ""The logic was that NACO was already giving funds to support the blood banks while the patients coming at these centres mainly hailed from poorer sections of the society,'' shared a member. The NBTC recommendation for universal charge said that the rates could be subsidised further after approval from its state counterpart -- SBTC. Using its power, the rates of blood in UP came down to Rs 250 for patients undergoing treatment in the hospitals while Rs 500 for other patients. The new order has slashed the rates further. Authorities, however, clarified that the new rates would not be applicable in private sector blood banks. "
53,5,2011,HIV drives 15 lakh kids homeless,http://timesofindia.indiatimes.com//city/jaipur/HIV-drives-15-lakh-kids-homeless/articleshow/8191551.cms," JAIPUR: City-based NGOs observed World AIDS Orphans Day on Saturday to draw attention to the plight of such children. They organised programmes to sensitise people. Lata Singh, programme cordinator of FXB India Suraksha, said 15 lakh children are homeless due to HIV in India. The situation is getting worse in Rajasthan despite the government's massive awareness programmes, she added. ""Jaipur has around 2,000 HIV positive children. This data is collected with the help of NGOs and hospitals. However, many of them are out of the reach of both,"" added Singh. Suraksha organised this programme at Virandavan marriage garden. They called around 20 HIV positive children along with activist working for rights of these children and government officials. During the programme some children narrated their tragic tales through songs. Sukhdev Singh (name changed) (14), a HIV positive says how his uncle abandoned him outside railway station in Solapur barely months after the death of his parents in a road accident. After living at the mercy of beggars at the station for some days, he came to Jaipur on the train and started consuming drugs. Here he was spotted by this NGO. After a medical test it was revealed that he is HIV positive. Since then, he underwent many counselling sessions and started going to school. Singh fears that people discriminate against HIV positives despite the government's massive awareness programmes. RU Professor Shashi Sahay addressed HIV positive students. She said that biggest challenge for civil society is to bring them into the mainstream. "
54,5,2011,"Fighting stigma, HIV kids create history of sorts",http://timesofindia.indiatimes.com//city/chennai/Fighting-stigma-HIV-kids-create-history-of-sorts/articleshow/8211008.cms," CHENNAI: The Tamil Nadu HSC results 2011 may be bringing tears of disappointment in some households, but in Anandha Illam in Periyapalayam, 40 km from Chennai, there are whoops of joy and celebration. A home for HIV affected children, the institution is awash with pride that the four children who appeared for their HSC exam this year have all passed and two of them with distinction. ""It's a good start for them,"" said Chitra Muthupandian. ""Their circumstances usually make it difficult for them to concentrate on studies."" This was more than true for 19-year-old Kumar*, a resident of Anandha Illam, who scored 66% in the examinations. An HIV infected student who lost both his parents to the disease, Kumar had dropped out of school in 7th standard due to various ailments that plagued him. ""Kumar himself later chose to resume his studies,"" added Chitra. Today, for Kumar, his score of 730 is ticket to a better life. ""I expected better marks, still I am happy with these marks,"" said Kumar. ""I am planning to do my Bachelors in computer sciences. Hopefully, I shall be able to get into Madras University itself."" A similar sentiment was echoed by Geetha*, another resident of the institution who scored 56%. ""I could have scored more marks, but this would to do, I guess,"" she said with a shrug. Though not infected by HIV herself, Geetha lost both her parents to AIDS. Today her sole family is her younger sister, who is HIV positive. Well aware of the disease that killed her parents, Geetha tends to get upset and disturbed whenever her sister falls ill, said employees at the home. Possibly that's what prompted Geetha towards her chosen field nursing. ""I am trying for BSc Nursing,"" she said. ""Hopefully, I'll get a seat in a good college."" The toppers at the home are two sisters, the elder scoring 83% while the younger one scored 78%. Daughters of HIV infected parents, Revathi* and Raagini* live at the home with their mother who doubles up as a cook. Their father succumbed to the disease a long time ago. But even happy moments like these tend to have a hint of gloom caused by absence of families, say officials at the home. ""Happy though they are with their achievement, they do tend to feel bad that they have no family to share it with,"" said Chitra. ""It makes all the difference in the world when a parent is around to motivate you and share in your joys."" * Names changed to protect identities "
55,5,2011,A home away from home for HIV+ orphans,http://timesofindia.indiatimes.com//city/jaipur/A-home-away-from-home-for-HIV-orphans/articleshow/8211828.cms," JAIPUR: It’s home away from home for the 20 children orphaned by HIV/AIDS. The double-storey house in Sector 6 of Malviya Nagar looks humble but it is a paradise for these impoverished children who themselves are carriers of the HIV and had faced social stigma after their parents succumbed to the deadly virus or abandoned them. When these children were found abandoned, Smriti Singh, who founded the AIDS care centre under the Faith Foundation, working for HIV positive orphans, adopted them. “They are my best friends. To see them grow healthier is my life’s aim,” the samaritan said. Smriti is among very few people in the city who came forward to help the HIV positive children. She is fondly called ‘Maa’ by these kids. Everyday, they ran towards the gate to receive her and she, too, doesn’t forget to bring chocolates for them. Most of the children aged between six and 16 years were found abandoned in various parts of the state. The latest inmate to join the care centre is eight-year-old Raghu. The pale and thin boy weighs only 12 kilos. He was found HIV positive after his mother was admitted to hospital in 2009. She died after a prolonged illness in 2010. His father left him alone as he left for work in Gujarat. “Most of them were subjected to discrimination in their respective areas. They were ill-treated by their close relatives after knowing their status,” Smriti said. The SMS Hospital, where they were brought initially for treatment, recommended these children to the care centre, which provided them food, shelter and treatment, apart from their schooling at a nearby institute. “In the school, they never face any problem. They mingle with other kids, play with them and exchange notes,” Smriti said. To make the children feel at home, she stuff the centre with toys, puzzles, pool table, cricket and badminton kits. The house has four rooms with each of them having colourful paintings and drawing by the children. A special study room with computers and general knowledge charts is also there where the children undergo many activities, including exercises, fun games and puzzles to sharpen their mind. On the children’s health, Smriti said, “These kids are prone to seasonal diseases and often require intense medication. Hence, I stocked all kinds of medicines in all corners of house.” Kausal, a volunteer at the foundation, said, “I monitor everyone during meals. These kids require nutritional food to help them grow and fight against diseases.” To make the life of these children exciting, the foundation plans to take them on a trip to Goa. “The kids are now very excited about their flight to Goa. Throughout the day, they make plans on how they will make most of the trip,” Kausal said. Also, volunteers both from India and abroad spend quality time with the children at the home during summer months or their pre-job breaks. “I share happiness and my time with them. It gives me immense pleasure to teach them English,” said Pauline Agache, a language student from Belgium, on her visit to the care home. The foundation generate funds by organising luncheons and dinners for the corporate houses as it does not take direct donations and grants. "
56,5,2011,HIV patients take refuge in Pingalwara,http://timesofindia.indiatimes.com//india/HIV-patients-take-refuge-in-Pingalwara/articleshow/8236384.cms," MRITSAR: Non-government organization Pingalwara, an orphanage, has provided refuge to 11 HIV patients including six women who would have otherwise passed away due to lack of medical treatment, as they had been abandoned by their kin. After nine months of treatment in Pingalwara, Dimpy (name changed), 19, is now a familiar face here. Dimpy learns stitching and embroidery and helps fellow patients and other inmates. ""I don`t remember how I came here. My family never tried to trace me,"" she said. Poornima (name changed), another patient from West Bengal, who is undergoing treatment for the past two years, shared similar thoughts. Others are from Uttaranchal and Punjab. ""People who discriminate against HIV patients should take a lesson from here,"" said Pingalwara administrator Darshan Singh Bawa on Monday. He said that all inmates shared food and lodging. Medical social worker Gulshan Ranjan said that before patients are admitted, they are sent for medical examination at Guru Nanak Dev Medical College. ""Regular medical checks of HIV patients are conducted to know their immunity level,"" he said. Ward in charge Promilla said that these HIV patients are otherwise healthy and could look after themselves. Foundation of Pingalwara was laid in 1934 when a spastic child was found abandoned in front of Gurdwara Dera Sahib, Lahore. Head granthi gave the custody of the child to Bhagat Puran Singh, who for 14 years, took care of the kid. After partition, Bhagat Puran Singh set up a camp at Khalsa College and then at Pingalwara, which is now a home to thousands. "
