,month,year,name,link,article
45,5,2014,HIV-positive man kills cancer victim at Bombay Hospital,http://timesofindia.indiatimes.com//city/mumbai/HIV-positive-man-kills-cancer-victim-at-Bombay-Hospital/articleshow/35031946.cms,"MUMBAI: A 65-year-old cancer patient, Lilabihari Thakur (left), died and two others were injured in Bombay Hospital on Monday morning when an HIV-positive TB patient attacked them with a metal saline bottle stand, apparently without provocation. The attacker, a 42-year-old Agripada resident (name withheld by TOI), was subdued by ward boys and relatives of other patients in the third-floor general ward and handed over to the police. Dean T P Lahane said he seemed to display symptoms of schizophrenia. He has been admitted to a ward in JJ hospital, and his arms bound, said sources. He has been charged with murder, but is yet to be arrested. Police said around 6.30am, he came out of the toilet and attacked Thakur, whose lung cancer was in an advanced stage, but who was to be discharged in three days after a month’s stay in the hospital. “By the time, ward boys and patients’ relatives could stop him, he had smashed Thakur’s head,” said a source. Thakur was rushed to the hospital ICU, where he was pronounced dead after three hours. The Agripada resident also attacked two other patients—Praful Parmar (70) and Janardhan Arte (66)—who are in a stable condition. Thakur’s son Pankaj said his mother Miradevi had been at his father’s bedside since he was admitted on April 12. “On Monday morning, my mother had gone downstairs to bring medicines. The attack took place around that time. He hit father thrice with the rod, hurting his head. My father was bleeding profusely,” said Pankaj, who works in a private firm as administrator. “He had hit the other two patients on their heads too,” he added. The police said the people at the ward struggled to overpower the man. “He was so violent three to four men could not control him. Sister Alina Anthony, the nurse who is the complainant, said he was finally pinned down to a chair by several people, given a sedative injection and tied up,” said a policeman. The accused was undergoing treatment for tuberculosis meningitis at Bombay Hospital since May 8. “He is a known case of tuberculosis and HIV, and had been admitted here even last year with similar health complaints,” said Dr Sagar Sankhle, Bombay Hospital spokesperson. The accused had been cooperating with all diagnostic tests and had never showed any violent behaviour until Monday, he added. The accused used to work in a private firm until he was diagnosed with HIV. He then went into depression and was under treatment at several places before coming to the Marine Lines hospital, said the police. There was no enmity between the accused and Thakur, who came from Agra and worked as a taxi driver in Mumbai for over 30 years, or planning in the attack, said senior inspector Narendra Singh. Thakur, a resident of Pratiksha Nagar in Sion, is survived by his wife, three sons and two sisters. He needed regular clearing of lungs for fluid retention and was first admitted to the general ward. His health deteriorated and he was shifted to the ICU. “On April 30, he was brought back to the general ward. We were happy he was recovering and hoping to go home soon,” added Pankaj."
46,5,2014,"Dosage of key drug for HIV+ too low to counter TB, reveals study",http://timesofindia.indiatimes.com//city/chennai/Dosage-of-key-drug-for-HIV-too-low-to-counter-TB-reveals-study/articleshow/35175799.cms,"CHENNAI: Experts may fret about overprescription of drugs for tuberculosis, but it has emerged that central health authorities’ mandatory dosage of a key drug for HIV-infected patients with the disease is too low for it to be effective. 	A study by National Institute for Research in Tuberculosis found that dosage of rifabutin — a second-line drug for HIV-infected TB patients — prescribed by Revised National TB Control Programme (RNTCP) is insufficient to tackle mycobacterium tuberculosis, the causative agent of the disease, one of the leading causes of death among AIDS/HIV+ patients. 	“The programme recommends 150mg of the drug thrice a week. But based on our studies of blood samples collected from 17 patients, we found that for 150mg of rifabutin to work, patients would have to take the drug every day,” said Dr Geetha Ramachandran, who led the study. 	The subjects of the study were all patients at Government Hospital of Thoracic Medicine, Tambaram. All of them had failed to respond to first-line treatment. 	Researchers found that the RNTCP stipulated dosage administered to seven patients was too low to counter the disease. Four of the subjects died during the course of the study. 	“Ten of the patients, who received a dosage of around 30mg/ml higher than that prescribed by the RNTCP, showed favourable response to the treatment,” Dr Ramachandran said. 	Experts say the dosage of the drug has always been a matter of debate, with doctors exercising extra caution due to possible chemical interaction of medicines for HIV and TB. 	“While in some countries like the US, the dosage of rifabutin has been increased from 150mg three days a week to the same amount daily, in India insufficient data and studies resulted in health authorities failing to increase the dosage,” NIRT director Soumya Swaminathan said. 	The researchers have presented the results of the study to the National AIDS Control Organisation. “A multi-centric study will be undertaken in different parts of the country to assess the effect of rifabutin. This could change the drug regimen for HIV-positive patients with TB,” Dr Swaminathan said. 	Experts say 60%-70% of HIV-infected patients are likely to develop TB, mostly those on second-line therapy. 	“There are several factors that may lead to poor treatment outcome, including malnutrition and other infections. The dosage of rifabutin, which kills the bacteria, is also a contributing factor which can’t be taken lightly. Although we recommend daily dosage, more studies will be required to determine the optimal level,” Dr Ramachandran said. "
47,5,2014,"Soon, get HIV tests done at UK supermart",http://timesofindia.indiatimes.com//world/uk/Soon-get-HIV-tests-done-at-UK-supermart/articleshow/35180883.cms,"LONDON: Britons can now get a quick HIV test — in 60 seconds flat, when they visit a supermarket. A British sexual health charity has decided to offer HIV tests at a supermarket in Slough from May 19. The charity has teamed up with Tesco Express in central Slough to offer testing in their store. Testing will be held in a private room. “Our Time to Test project now offers the 60 second Insti HIV test, as well as the 20 minutes swab test. When you book you can choose which test you’d prefer,” the charity said. Slough has previously been named as an HIV hot spot by the department of health. The Time to Test project will run on a weekly basis for six weeks. "
48,5,2014,New regimen to reduce HIV risk to infants,http://timesofindia.indiatimes.com//city/jaipur/New-regimen-to-reduce-HIV-risk-to-infants/articleshow/35624311.cms,"JAIPUR: New multi-drug antiretroviral (ARV) regimen has been initiated in the state aiming to further reduce the risk of vertical HIV transmission from HIV infected mother to her newborn. The decision has been taken to promote birth of HIV-free children. The Rajasthan State Aids Control Society (RSACS) has initiated lifelong multi-drug antiretroviral (ARV) regimens for all pregnant and breast-feeding women living with HIV. The transmission of HIV from infected mother to her newborn is one of the leading causes of spread of HIV. According to RSACS, it is estimated that 5.2% of total HIV infections are due to transmission of HIV from mother to newborn. To deal with it, earlier the RSACS was providing single dose of Nevirapine to such women at the time of labour pain to prevent the HIV transmission from mother to her newborn baby. But, from May 19, the RSACS has changed its strategy. Health department's project director (AIDS) Dr SS Chauhan said, ""From an HIV infected mother, the risk of vertical transmission of HIV to newborn is 30%. But, a single dose of Nevirapine reduces the risk to around 15%. So far we were giving single dose of Nevirapine to pregnant women at the time of delivery. But, still the high risk (up to 15%) remained the cause of concern for us. Now, to bring down the percentage of risk of vertical transmission of HIV from mother to her newborn, we have initiated the lifelong ART (triple drug regimen). The multidrug ARV regimen would further decrease the risk from 11% to up to 5%. It will be the major benefit of the new multidrug regimen."" The triple drug regimen includes — Tenofovir, Lamivudine and Efavirenz. The three drugs would be administered to the women living with HIV and her infant. The drug would continue lifelong to reduce mortality and morbidity in mothers and children. The RSACS is spreading awareness of HIV testing among pregnant women. They take consent of pregnant women for HIV testing. If the women test positive for HIV, they link the women with anti retroviral therapy centre. Also, they put effort to prevent the transmission of HIV to her newborn. In 2013-14, the RSACS conducted HIV testing on 4.68 lakh pregnant women and found 412 women living with HIV. In 2012-13, the RSACS had tested 3.86lakh pregnant women and found 383 of them living with HIV. They have linked the newborns with antiretroviral therapy centres. An RSACS official said that they have provided training to its staff to start the new multidrug regimen. The new multidrug ARV regimen is part of prevention of parent to child transmission (PPTCT) of HIV launched in 2001-02 by ministry of health and family welfare."
49,5,2014,Corporate-NGO partnership for HIV programme stressed,http://timesofindia.indiatimes.com//city/hyderabad/Corporate-NGO-partnership-for-HIV-programme-stressed/articleshow/35798968.cms,"HYDERABAD: India HIV AIDS Alliance, an NGO, and the Federation of Indian Chamber of Commerce and Industry (FICCI) have teamed up to create a platform to sensitize corporate India on public health issues particularly HIV AIDS in Telangana and Andhra Pradesh. Speaking at a conference, 'Coming together-a partnership for public health' organised in the city on Friday, organizers said FICCI will explore avenues to extend support to the vulnerable population in both states. ""At a time when international funding is dwindling for the HIV programme in India, partnership with corporate donors for continuous investment to improve health of the marginalised populations in India is important,"" said Ganesh Ramakrishnan, director, Avahan Programme Bill &amp; Melinda Gates Foundation. Experts said there is an urgent need for partnership between the corporate sector and NGOs for improving public health and provide livelihood opportunities to marginalised sections. ""There is a sharp increase in cases of violence against sex workers. We are looking at involving corporates to provide funding to initiate an alternate livelihood skills mechanism for these women,"" said Dr P Prabhakar, director, India HIV AIDS Alliance, Andhra Pradesh. A budget of about Rs five crore is required to take up the skill development programme, he said. ""The National Aids Control Organisation (NACO) does not provide funding for such a programme,"" said Dr Prabhakar. Currently, the united state of AP has the highest population of people living with HIV AIDS - an estimated five lakh people. The AP State Aids Control Society is reaching out to 1.52 lakh sex workers and 40,000 men having sex with men through its initiatives. ""With the advent of New Companies Act 2013 and special emphasis on Corporate Social Responsibility (CSR), support for initiatives would immensely help corporates and NGOS to eradicate sexually transmitted diseases including HIV AIDS in the days to come,"" said Sangita Reddy, chairperson, FICCI. During 2014-15, Corporate India is supposed to spend an estimated Rs 20,000 crore on corporate social responsibility (CSR) as per the mandatory regulation introduced this year. ""The regulation says that the corporate firms are supposed to spend two per cent of their net profits on CSR,"" said Rony Antony, director, Tax and Regulatory Services, KPMG. If the money is pumped into the right initiatives, it can transform the public health system for good, he said. ""Firms can partner with NGOs and fulfill their CSR initiatives. They can earmark specific funding for HIV AIDS and other programmes on healthcare,"" he added."
50,6,2014,Family abandons woman after she tested HIV positive,http://timesofindia.indiatimes.com//city/jaipur/Family-abandons-woman-after-she-tested-HIV-positive/articleshow/35861108.cms,"AJMER: A woman was abandoned by her family when they came to know that she was HIV positive. This was revealed when she went to a hospital after conceiving a child. She was thrown out from her house and then she went to the police but no one came to help her. The woman then took the case to court and on its orders her husband was arrested and sent to jail. This happened nearby Kishangargh, where a woman accused her husband of not even returning her personal clothes. ""They have not even returned my clothes and discarded me like an animal. I went to my parents but they even fear to keep me in the family,"" said the victim. According to the police, the couple got married in 2009 and has a kid. ""At the time of her first delivery all reports came normal,"" said the report given to the court. The report further read that last year she fell ill and was taken to a private hospital for treatment. Again last month, the woman conceived a child and was taken to hospital where she was found HIV positive. ""When the family came to know about the report they abused her and threw her out of the house,"" the report read. The woman then went to the police, who did not help her fearing that HIV will spread by her presence. At last she approached the court. After hearing her side the court ordered to initiate enquiry and action against her husband."
51,6,2014,"Strike hits HIV counselling, testing work",http://timesofindia.indiatimes.com//city/pune/Strike-hits-HIV-counselling-testing-work/articleshow/36014529.cms,"PUNE: The HIV counselling, testing and treatment work has been affected due to state-wide strike of employees of the Integrated Counseling and Testing Centre (ICTC) and Anti-Retroviral Therapy centres (ART) which started on Monday. Thousands of people reporting at these centres for HIV counselling, testing and treatment had to return unattended on Monday and Tuesday due to absence of staff, who have abstained from work pressing for their long-pending demands. There are about 600 ICTC centres in the state with a workforce of 2,283 people that includes counsellors, technicians, doctors, nurses, data entry operators and district programme officers. On average, 80 to 90 people visit an ICTC centre every day. Of them, 10% who test positive have to visit ART centres periodically for treatment. ""Our foremost demand is immediate absorption of the staff in permanent services. Besides, salaries are irregular and sometimes not paid for two to three months at a stretch. We want the government to pay us every month and also issue salary slips so that we can apply for loans,"" said Pradip Shinde, president of the Association of the Employees of Maharashtra State AIDS Control Society. Shinde said that women staffers get only two months of maternity leave. ""We want the state government to extend the maternity leave benefit to six months,"" he said. There are 42 ICTC centres in Pune district alone. As many as 11 ICTC centres are located in the municipal limits of Pune city and five in Pimpri Chinchwad. In Pune city, the centres are based at Sassoon general hospital, Bharati hospital, Armed Forces Medical College (AFMC), Sane Guruji Hospital, PMC-run Kondhwa Hospital, Yerawada maternity home and Yerawada jail. There are four ART centres in Pune. One is located at Sassoon General Hospital, one in AFMC, another one is at National AIDS Research Institute (NARI) and one is based at the Yashwantrao Chavan Memorial Hospital in Pimpri. ""The staff attached to ART centres in Thane, Latur and Osmanabad are either on long leave or have joined the agitation. All ART centres have stopped functioning from June 2. In other parts of the state, the staff is working with black ribbons as a mark of protest,"" said Avinash Jadhav, vice-president of the association in Pune district. A senior official of Maharashtra State AIDS Control Society said, ""We get funds from the Union government to run ICTC and ART centres. There are some technical issues that need to be sorted out before absorbing the staff in permanent services. The work of ART centres has not been affected much due to the strike. Since most of the centres are attached to hospitals, doctors, nurses and medical students are being pressed into service."" Staffers' demands * Give permanent jobs * Regularise salaries * Issue salary slips * Facilitate easy transfer * Extend maternity leave to six months About ICTC * An Integrated Counseling and Testing Centre (ICTC) is a place where a person is counselled and tested for HIV on his own free will or as advised by a medical provider * There are more than 4,000 such centres in the country with 600 of them located in the state * An ICTC conducts HIV diagnostic tests, provides basic information on modes of HIV transmission, promotes behavioural change to reduce vulnerability and link people with other HIV prevention, care and treatment services * As per the guidelines of the National AIDS Control Society (NACO), the ICTC provides three HIV tests - the first to detect the virus and the second and third to confirm the patient is positive"
52,6,2014,"Submit report on action taken against lab in false HIV case, says Maharashtra legislative council chairman",http://timesofindia.indiatimes.com//city/mumbai/Submit-report-on-action-taken-against-lab-in-false-HIV-case-says-Maharashtra-legislative-council-chairman/articleshow/36221922.cms,"MUMBAI: The home ministry got an earful from legislative council chairman Vasant Daokhare on Saturday when he asked it to submit in a week a report on action taken against a Kandivli pathological lab which allegedly gave a man a wrong HIV-positive report and blackmailed him. The directives came after legislators Bhai Girkar, Ashish Shelar and others blamed the home ministry for granting “favours” to the accused and the owners of ‘The Pacific Lab’, Geeta Mehra and Rajendra Mehra, by delaying the investigation. Despite assurance from minister of state for home Satej Patil that the investigation would be completed within 15 days and stern action would be taken against the Mehras, the legislators sought Daokhare’s intervention. Girkar and Shelar said the lab owners had allegedly asked for Rs 1 lakh from the man who was tested to cure him and later pressurized him to withdraw the police complaint."
53,6,2014,Number of HIV cases among expectant mothers decline,http://timesofindia.indiatimes.com//city/aurangabad/Number-of-HIV-cases-among-expectant-mothers-decline/articleshow/36266502.cms,"AURANGABAD: With increase in public awareness, more and more women are going for HIV test every year. At the same time, the number of women testing positive for HIV in district is declining, statistics show. In an attempt to prevent passing the HIV virus from mother to child, the Parliamentary Forum on HIV and AIDS had encouraged pregnant mothers to undergo HIV test at an early stage. Mangesh Gaikwad, programme officer, Aurangabad district AIDS preventive and control unit, said: ""Aiming that all pregnant women undergo the test, the state government has taken initiatives, which include opening of integrated counselling and training centres throughout the district. The spread of awareness has resulted in increasing number of pregnant women going for HIV test every year. The figure has jumped from 22,497 in 2007 to 54,169 in 2013."" Gaikwad added: ""Meanwhile, the number of women testing positive for HIV is declining. In 2007, 81 pregnant women in the district tested HIV positive, while, in 2013, only 33 tested positive."" ""The state government in co-operation with the Maharashtra State AIDS Control Society has provided various facilities under the prevention of parent to child transmission programme, including free HIV test for pregnant women, counselling on antenatal care and sexually transmitted diseases, distribution of nevirapine prophylaxis to mother and child for reducing HIV transmission from mother to child,"" he said. ""The state government has also opened 21 ICTCs (integrated counselling and testing centres) for early diagnosis of HIV infection in a child,"" Gaikwad said. He said, ""Though, we cannot force women to go for HIV test as it is against human rights, we try to persuade them as it is beneficial for their children. If a pregnant woman tested positive, we try to reduce the chance of transmission of HIV to her child by up to 4%."" ""Awareness among pediatricians about mother-to-child HIV transmission needs to increase. We have to ensure similar awareness among the society, so that we can reduce the number of HIV positive cases over a period of time,"" Gaikwad said."
54,6,2014,HIV positive man who killed fellow patient held,http://timesofindia.indiatimes.com//city/mumbai/HIV-positive-man-who-killed-fellow-patient-held/articleshow/36363511.cms," MUMBAI: The Azad Maidan police on Monday arrested a HIV positive patient (42) who is accused of murdering a fellow patient and injuring two others at Bombay Hospital on the morning of May 12. The accused was undergoing treatment at JJ Hospital for his mental condition and was admitted to Bombay Hospital on May 8. Four days later, he turned violent and killed a patient, Lilabihari Thakur (63), using a saline rod. Two others—Praful Parmar (70) and Janardhan Arte (66)—were injured in the attack. The hospital staff then overpowered him and sent him to J J hospital. He is now in police custody for murder, attempt to murder and voluntarily causing hurt with use of sharp weapon."
55,6,2014,Depressed HIV+ve woman commits suicide at Khajrana,http://timesofindia.indiatimes.com//city/indore/Depressed-HIVve-woman-commits-suicide-at-Khajrana/articleshow/36718162.cms,"INDORE: A woman was found hanging in a room in Khajrana area on Sunday late night. According to the police, resident of Khajrana area Begum Bi was afflicted with HIV and was fed up of diseases, which forced her to take the extreme step. 	The woman was suffering from the disease since last two years and was under acute depression. The family members knew about her suicidal tendency and remained alert to avoid any untoward incident. However, on Sunday night the woman was seen hanging with a ceiling fan by her husband who informed the police. The body was sent for post mortem on Monday. 	Estranged by wife, man ends life: A man estranged by his wife three years back was found hanging with a ceiling fan on Monday. According to Vijay Nagar police, resident of Sundar Nagar, Ravi Parmar was alone and this could be a possible reason behind committing suicide. No suicide note has been recovered. On Monday, Ravi’s neighbour went to meet him. When nobody opened the door he peeped from the window and found him hanging. He then informed the police. The police said that Ravi’s parents had gone to Nagda town for some work. They had to return on Monday. Police are investigating the case. 	Youth held for harassing class IX girl: The ‘We care for you cell’ of Indore police on Monday arrested a 21-year-old youth who was harassing a class IX student girl since last five months. According to police, resident of Martand Nagar, Dinesh Solse had crush on the girl and was instating the victim for friendship. When the girl refused, the accused managed to get her mobile phone number and started sending her messages. Fed up with the harassment, the girl’s mother lodged a complaint with the cell on Saturday after which police took the accused in custody. In charge of the cell, Soma Mailk said the accused has been handed over to the Rajendra Nagar police. "
