,month,year,name,link,article
83,8,2014,Doctor who misinformed Rivona locals about HIV gets medico panel breather,http://timesofindia.indiatimes.com//city/goa/Doctor-who-misinformed-Rivona-locals-about-HIV-gets-medico-panel-breather/articleshow/40320267.cms,"PANAJI: The state wing of the Medical Council of India (MCI) has expressed its inability to take action against a doctor in Rivona who allegedly gave misinformation about HIV/AIDS to parents from the village who were opposing the admissions given by a local school to 13 HIV-positive students from a community care centre. 	The Goa medical council’s ethics and disciplinary committee—heeding the state commission for protection of child rights’ complaint against Dr Auvduth Prabhudessai—has concluded that since the doctor is not registered with the council it has no jurisdiction in the case. The commission’s chairperson Samira Kazi said the department is exploring other possibilities of taking action against Prabhudessai. 	When contacted by STOI, Prabhudessai refused to reveal what he had advised the villagers, saying only, “I’m responsible for the welfare of my village.” Asked if he had misinformed locals about HIV/AIDS, he said he would reply only to an inquiry against him. 	Chief minister Manohar Parrikar recently assured the legislative assembly that action would be taken against the doctor, after Sanguem MLA Subhash Faldessai raised the issue in the House. 	Before his retirement, Prabhudessai worked for the directorate of health services and also served in the armed forces. Post retirement he runs a private practice at Colomb, Rivona. Asked if he is open to the idea of children with HIV being given admissions in regular schools, Prabhudessai said, “It is a debatable issue.” He refused to elaborate, saying he did not want to answer such questions telephonically. 	He informed STOI that he was registered with the Maharashtra Medical Council after getting his degree, as the Goa council did not exist then, and later he did register with the Goa council. It is mandatory for every doctor to register with the state medical council or MCI if they want to practice in India. It is also compulsory for doctors to renew this registration every five years. 	The controversy over admissions to HIV-positive children raged for over a fortnight in June-July, and was finally resolved through government intervention. It saw over 40 parents withdraw their wards from the school where the children with HIV were finally admitted. "
84,8,2014,"CM visits Rivona centre, eats with HIV+ kids",http://timesofindia.indiatimes.com//city/goa/CM-visits-Rivona-centre-eats-with-HIV-kids/articleshow/40320332.cms," MARGAO: In a show of solidarity chief minister Manohar Parrikar visited the Rivona-based community care centre, Nitya Seva Niketan, on Saturday, and had lunch with the children, including those who are HIV positive. Parrikar had recently told the legislative assembly he would share a plate of food with an HIV-positive person to prove that the disease is not transmitted by mere contact. This was following Sanguem MLA Subhash Phal Dessai raising, in the House, the issue of parents of students of a local school objecting to admissions given to HIV-positive children from the centre. On Saturday, he, along with Sanguem MLA Subhash Phal Dessai, shared a plate of food with the HIV-positive children and reiterated that the parents who withdrew their wards from the school in which these children are admitted had misplaced fears. The CM's stopover was part of his visit to Curchorem to inaugurate a new fire station. Praising the nuns for their work at the centre, Parrikar said it was unfair the children had been discriminated against. Expressing his love, affection, and gratitude, he extended the government's full support to the institute and the students. tnn"
85,8,2014,Dissolvable 'tampon' to protect against HIV,http://timesofindia.indiatimes.com//city/ahmedabad/Dissolvable-tampon-to-protect-against-HIV/articleshow/40354234.cms,"WASHINGTON: Researchers have developed a dissolvable tampon-like product that can carry substantial loads of medicine and could offer fast-acting HIV protection. Researchers at the University of Washington (UW) have developed the material which is capable of carrying substantial loads of medicine, dissolving and releasing the drugs once its comes into contact with moisture. The study builds on research conducted at UW's Department of Bioengineering in 2012. Dr Kim Woodrow and her team were experimenting with electrospinning, a process where a charged fluid containing polymers and antiretroviral drugs is projected from a syringe and through an electric field. The electric field causes the jet of liquid to break into tiny fibres, each measuring anywhere between 100 to several thousand nanometres, 'Gizmag' reported. These then come to land on a collecting plate and combine to form a stretchy fabric capable of blocking sperm and, as the researchers discovered, carrying and releasing contraceptives and antivirals. Because certain elements of the material can be controlled, such as the solubility, strength and size of the fibres, the researchers said that it may prove more versatile than other anti-HIV technologies currently in development. One sample dissolved within minutes, an application that could protect against unwanted pregnancy and sexually transmitted diseases. Another sample dissolved over several days, which could prove useful in sustained delivery of drugs, such as birth-control pills and anti-HIV medicines. The team said that the electrospun material can carry a large load of maraviroc, an antiretroviral drug used in the treatment of HIV which has minimal side effects. The research is published in the journal Antimicrobial Agents and Chemotherapy. "
86,8,2014,Andhra Pradesh has highest No. of pregnant HIV women ,http://timesofindia.indiatimes.com//city/hyderabad/Andhra-Pradesh-has-highest-No-of-pregnant-HIV-women/articleshow/40384478.cms,"HYDERABAD: Undivided Andhra Pradesh reported the highest number of pregnant mothers testing positive for HIV in 2013. According to recent data from the Union ministry of health and family welfare, 1,330 pregnant women of the nearly seven lakh carrying mothers screened in AP last year, tested HIV positive. The ministry data shows that in neighbouring states like Maharashtra and Karnataka, where a larger number of women were screened, the percentage of women testing positive was significantly lower. It has been estimated that a mother has 30 per cent chance of transmitting the virus to her baby during pregnancy. The mortality rate among children with HIV is much higher compared to adults owing to their under-developed immune systems. However AP fared better or equally well in treating mothers to prevent transmission to children, as evinced by the data which shows that 1,142 HIV positive pregnant women were put on treatment. To reduce the numbers of baby transmissions, AP government in a first launched a new regimen of medication and treatment modality in 2012. The new treatment modality requires mothers to start treatment 14 weeks into pregnancy as against earlier practice of taking medication at the time of delivery. The medication now comprises a combination of three drugs as against one compound that was given earlier. Babies now are also given the same medication after birth. Additionally, under the new treatment practice, babies are screened every six months after birth until 18 months of age, when a concluding diagnosis is made about their infection. According to P L Jayachandra Reddy, additional project director of AP State Aids Control Society, more than 90 per cent of the first batch of pregnant women in undivided AP, who were put on the new treatment modality in 2012, delivered babies without infecting them. “The transmission rate has come down to about five per cent. It has not been eliminated completely owing to drug resistance some of the women developed during treatment or due to delay in starting the treatment,” Reddy said. A team comprising members of World Health Organisation (WHO) and National Aids Control Organisation (NACO) established this during a study of AP’s implementation of the new treatment modality in March this year, 18 months after the first batch of women mentioned by Reddy, gave birth. Buoyed by AP’s success, the WHO-NACO team has recommended that the new treatment modality be taken up in other states. The data was released by Union ministry of health 1,330 pregnant women of the nearly seven lakh carrying mothers screened in undivided Andhra Pradesh last year, tested HIV positive, which is much higher than in other states "
87,8,2014,Andhra Pradesh has highest No. of pregnant HIV women,http://timesofindia.indiatimes.com//india/Andhra-Pradesh-has-highest-No-of-pregnant-HIV-women/articleshow/40384410.cms,"HYDERABAD: Undivided Andhra Pradesh reported the highest number of pregnant mothers testing positive for HIV in 2013. According to recent data from the Union ministry of health and family welfare, 1,330 pregnant women of the nearly seven lakh carrying mothers screened in AP last year, tested HIV positive. The ministry data shows that in neighbouring states like Maharashtra and Karnataka, where a larger number of women were screened, the percentage of women testing positive was significantly lower. It has been estimated that a mother has 30 per cent chance of transmitting the virus to her baby during pregnancy. The mortality rate among children with HIV is much higher compared to adults owing to their under-developed immune systems. However AP fared better or equally well in treating mothers to prevent transmission to children, as evinced by the data which shows that 1,142 HIV positive pregnant women were put on treatment. To reduce the numbers of baby transmissions, AP government in a first launched a new regimen of medication and treatment modality in 2012. The new treatment modality requires mothers to start treatment 14 weeks into pregnancy as against earlier practice of taking medication at the time of delivery. The medication now comprises a combination of three drugs as against one compound that was given earlier. Babies now are also given the same medication after birth. Additionally, under the new treatment practice, babies are screened every six months after birth until 18 months of age, when a concluding diagnosis is made about their infection. According to P L Jayachandra Reddy, additional project director of AP State Aids Control Society, more than 90 per cent of the first batch of pregnant women in undivided AP, who were put on the new treatment modality in 2012, delivered babies without infecting them. “The transmission rate has come down to about five per cent. It has not been eliminated completely owing to drug resistance some of the women developed during treatment or due to delay in starting the treatment,” Reddy said. A team comprising members of World Health Organisation (WHO) and National Aids Control Organisation (NACO) established this during a study of AP’s implementation of the new treatment modality in March this year, 18 months after the first batch of women mentioned by Reddy, gave birth. Buoyed by AP’s success, the WHO-NACO team has recommended that the new treatment modality be taken up in other states. The data was released by Union ministry of health 1,330 pregnant women of the nearly seven lakh carrying mothers screened in undivided Andhra Pradesh last year, tested HIV positive, which is much higher than in other states "
88,8,2014,Chhattisgarh fails to start HIV screening of pregnant women,http://timesofindia.indiatimes.com//city/raipur/Chhattisgarh-fails-to-start-HIV-screening-of-pregnant-women/articleshow/40549910.cms,"RAIPUR: Chhattisgarh government has failed to implement National Aids Control Organisation’s (NACO) programme of making HIV test screening of all expecting mothers in the state's health centres. This, despite the fact Chhattisgarh is among one of 13 states that account for 90% of HIV infected pregnant women in India. Union health ministry had fixed deadline of April 2014 for implementation of its programme, Prevention of Parent to Child Transmission of HIV (PPTCT) services, in all government run hospitals and health centres in the 12 affected districts of Chhattisgarh. However, four months after lapse of the deadline, PPTCT services are yet to start in health centres of the state. Even multi-drug regimen for preventing transmission of the disease from infected mother to foetus, which was to start in these health centres, has failed to take off. According to NACO’s data there are an estimated 38,204 HIV infected pregnant women across the country. Of these, 90% (34,465) are concentrated in 13 states including Chhattisgarh, Gujarat, Andhra Pradesh, Bihar and Madhya Pradesh. In Chhattisgarh, 233 such cases were detected in 2013-14. According to NACO officials 12 districts in Chhattisgarh – namely Raipur, Bilaspur, Dhamtari, Durg, Mahasamund, Rajnandgaon, Janjgir-Champa, Korba, Koriya, Raigarh, Bastar and Surguja- have been identified as priority areas for scaling up HIV-testing services to ensure timely detection of infected mothers. Dr SK Binjhwar, additional project director, State AIDS Control Society admitted delay in implementing of services in all community and primary health centres. He attributed this to delay in receiving grants for purchase of HIV testing kits. He said HIV testing services in all CHCs and PHCs is expected to commence by next month. He also disclosed that 4,500 auxillary nursing and midwifery (ANM) have been trained for screening of pregnant women for HIV. A recent NACO report on multi-drug anti-retro virals for PPTCT of HIV under National AIDS Control Programme in India, an estimated 1,097 HIV infected pregnant woman require PPTCT services in Chhattisgarh. As per the report 159 pregnant women were detected with HIV 2012-13. NACO officials said efforts are on to make HIV testing of all pregnant women mandatory in government hospitals. They admitted though consent of expecting mothers is required for a HIV test, they would counsel reluctant ones to ensure their participation. Officials said if a pregnant woman is tested positive, efforts are made to reduce chances of transmission of HIV to her child by giving Navirapine Prophylaxis. A dose of navirapine is given to mother at the time of delivery to prevent HIV transmission to child. According to NACO report, while 100% medical colleges and district hospitals have an HIV testing facility across the country, about 86% sub-district hospitals have the same. But lower down in the health system the levels of saturation differ in different phases. "
89,8,2014,Faulty HIV test on pregnant woman at Civil Hospital,http://timesofindia.indiatimes.com//city/gurgaon/Faulty-HIV-test-on-pregnant-woman-at-Civil-Hospital/articleshow/40881414.cms,"GURGAON: An HIV test at Civil Hospital during the initial trimester of her pregnancy was negative. So, the hospital provided her regular care and medicines. Now, weeks before the delivery date, she is in fear that the mistake by the hospital may end up affecting the baby she is expecting. Along with her husband, Asha (name changed), a Gurgaon resident from a semi-rural background, was detected HIV positive in 2011 by Civil Hospital. This year, the couple decided to have a child. After conceiving, in March, Asha visited Civil Hospital again. The hospital again put her through an HIV test, which is mandatory under Haryana government rules on all pregnant women. The 2011 report fell between the cracks. But this new report a copy of which is with TOI showed she was HIV negative. Asha proceeded to follow doctors' instructions, assuming they were aware of her HIV positive condition as those tests had been conducted in the same hospital, without noticing that this time, the results were different. Earlier this month, when she visited a gynaecologist at Civil Hospital for a check-up, Asha told her she was HIV positive. The gynaecologist immediately got another test done at the hospital. This time, the result was positive. The lab staff made a new report on August 19. The hospital, subsequently, referred the case to a Delhi hospital. ""We'll first have to figure out why she was referred to a new hospital. We're carrying out investigations. Action will be taken if lab reports were found to be false,"" said CMO Pushpa Bishnoi. Asked about the impact of the faulty report on the baby, a city-based gynecologist said, ""Although it depends on the viral load in her body, since in this case both husband and wife are infected, she (Asha) should have been given anti-virus therapy from the beginning."""
90,8,2014,Stock-out hits HIV treatment across India,http://timesofindia.indiatimes.com//india/Stock-out-hits-HIV-treatment-across-India/articleshow/40886596.cms,"MUMBAI: Treatment for HIV patients across India has taken a hit, especially in Delhi and Mumbai, due to severe stock-outs of life-saving medicines reported at government-owned centres. Shortage of first-line (initial), second-line (advanced) and paediatric HIV drugs, besides crucial diagnostic kits, has prompted patient groups to send a legal notice to the government, pointing to the scarcity, gaps in procurement and supply of these drugs. The treatment and control of HIV, including dispensing drugs and testing, is handled by the government-run public health programme through its 355-odd centres. Of the over two million HIV-infected people in India, four states — Andhra Pradesh, Karnataka, Maharashtra and Tamil Nadu — account for 53%. More than one-third of them, or 7.5 lakh patients, are on the public health programme this year. While the medicines are available in the retail market at a cost, the ones dispensed at government-owned centres come free. At certain centres in Mumbai and Delhi, partial doses of treatment are being provided to patients for a few days, forcing them to return frequently. Alternatively, drugs are being substituted. Hospitals such as AIIMS, Safdarjung and LNJP in Delhi, and Nair, KEM, Siddharth and Sion in Mumbai have been grappling with shortage of these drugs. Prices of first-line HIV drugs in the retail market has come down now substantially due to affordable generic medicines. The treatment costs lakhs of rupees for advanced therapies for certain patients. While, retail first-line drugs cost Rs 5,500 a year, the advanced and complex therapies come at around Rs 20,000 to Rs 2 lakh a year. In a legal notice to the health ministry sent on August 22, the Delhi Network of Positive People (DNP+), representing HIV patients, has sought emergency procurement and relocation of stocks to government-owned centres experiencing stock-outs of ARVS, particularly in Mumbai. They have also sought strengthening and streamlining drug forecasting, procurement and supply chain mechanism to prevent future shortages. Stock-outs have hit centres in Delhi, Maharashtra, Gujarat, Karnataka and Manipur the worst, Vikas Ahuja of International Treatment Preparedness Coalition, South Asia, told TOI. Drug supply has been erratic over the past few months, Ahuja said. Bureaucratic delay in tendering, procurement and supply has been cited as the reason, besides the mechanism not being planned proactively and in a streamlined way. As per NACO guidelines, patients adhering to the treatment should get the medicines for at least a month. Industry experts say shortage of second-line therapy has existed in certain centres since 2012, and that of diagnostic kits since last year."
91,8,2014,"Proteins that inhibit HIV, Ebola release identified",http://timesofindia.indiatimes.com//home/science/Proteins-that-inhibit-HIV-Ebola-release-identified/articleshow/40911485.cms," WASHINGTON: In a surprise finding, scientists have discovered that a family of proteins that helps viruses, such as HIV and Ebola, enter a cell can also block the release of these deadly viruses. 	""This is a surprising finding that provides new insights into our understanding of not only HIV infection, but also that of Ebola and other viruses,"" said Shan-Lu Liu, associate professor in the University of Missouri School of Medicine's Department of Molecular Microbiology and Immunology. 	AIDS is a condition characterised by progressive failure of the immune system. It is caused by the human immunodeficiency virus type 1 (HIV-1). 	When HIV-1 or any virus infects a cell, it replicates and spreads to other cells. One type of cellular protein - T cell immunoglobulin and mucin domain, or TIM-1 - has previously been shown to promote entry of some highly pathogenic viruses into host cells. 	Now, researchers have found that the same protein possesses a unique ability to block the release of HIV-1 and Ebola virus. 	""This study shows that TIM proteins keep viral particles from being released by the infected cell and instead keep them tethered to the cell surface,"" said Gordon Freeman, associate professor of medicine with Harvard Medical School's Dana-Farber Cancer Institute. 	""This is true for several important enveloped viruses including HIV and Ebola. We may be able to use this insight to slow the production of these viruses,"" said Freeman. 	Under the supervision of Liu, Minghua Li, a graduate student in the MU Pathobiology Area Programme, performed a series of experiments that revealed the protein's ability to inhibit HIV-1 release, resulting in diminished viral production and replication. 	HIV-1 attacks cells that are vital to the body's immune system, such as T cells. These white blood cells play an important role in the body's response to infection, but HIV-1 disrupts the cells' ability to fight back against infection. 	When the virus enters a host cell, it infects the cell and replicates, producing viral particles that spread to and infect other cells. 	The researchers found that as the viral particles attempt to bud from, or leave, the infected cell, the TIM-family proteins located on the surface of the cell can attach to lipids on the surface of the viral particle. 	These lipids - known as phosphatidylserine (PS) - are normally present on the inner side of the cellular membrane but can be exposed to the outer side upon viral infection. 	When the TIM-family proteins come in contact with PS, the viral particle becomes attached to the host cell, keeping the particle from being released from the cell. 	Because TIM-family proteins and PS are present on the surface of the cell and the viral particle, the viral particles get stuck to one another, forming a network of viral particles that accumulate on the surface of the host cell, rather than being released to infect other cells. 	The study was published in the journal PNAS. "
92,8,2014,HIV+ dalit couple harassed for 2 years,http://timesofindia.indiatimes.com//city/bhubaneswar/HIV-dalit-couple-harassed-for-2-years/articleshow/40977763.cms,"KORAPUT: A dalit HIV positive couple, who have been living a nightmare for the past two years because of repeated harassment and assault by fellow villagers, have turned to the Rayagada district collector for help. Not only have the villagers stopped them from using the village pond and tube well, they even tied up Sushant Naik (name changed) to a tree, beat him up and threw human excreta at him on one occasion. The couple's sorry plight came to light on Monday, when Naik and his wife, of Bhairagada village located about 70 km from the district headquarters town of Rayagada under Muniguda block, met collector Sashi Bhushan Padhi at his grievance cell and told him about their experience. The couple were diagnosed HIV positive in 2012 when their blood samples were examined during the woman's pregnancy. ""On the advice of doctors, we immediately started taking medicines and my wife delivered a son at Koraput hospital. By the grace of God, our son is not affected by HIV,"" said Naik. However, the dalit couple's happiness over the birth of their child didn't last long as the news about their disease reached the village. The villagers soon started ostracizing the couple and placed several restrictions on the family. "
